Date,Province_State,Country_Region,Last_Update,Confirmed,Deaths,Recovered,Latitude,Longitude,FIPS,Admin2,Lat,Long_,Active,Combined_Key
03-13-2020,Alabama,US,2020-03-11T20:00:00,5,0,0,32.3182,-86.9023,,,,,,
03-14-2020,Alabama,US,2020-03-14T16:53:03,6,0,0,32.3182,-86.9023,,,,,,
03-15-2020,Alabama,US,2020-03-15T18:20:19,12,0,0,32.3182,-86.9023,,,,,,
03-16-2020,Alabama,US,2020-03-16T22:33:03,29,0,0,32.3182,-86.9023,,,,,,
03-17-2020,Alabama,US,2020-03-17T23:13:10,39,0,0,32.3182,-86.9023,,,,,,
03-18-2020,Alabama,US,2020-03-18T19:33:03,46,0,0,32.3182,-86.9023,,,,,,
03-19-2020,Alabama,US,2020-03-19T23:43:04,78,0,0,32.3182,-86.9023,,,,,,
03-20-2020,Alabama,US,2020-03-20T21:43:03,83,0,0,32.3182,-86.9023,,,,,,
03-21-2020,Alabama,US,2020-03-21T23:13:18,131,0,0,32.3182,-86.9023,,,,,,
03-23-2020,Alabama,US,2020-03-23 23:19:34,0,0,0,,,1001,Autauga,32.53952745,-86.64408227,0,"Autauga, Alabama, US"
03-23-2020,Alabama,US,2020-03-23 23:19:34,3,0,0,,,1003,Baldwin,30.72774991,-87.72207058,0,"Baldwin, Alabama, US"
03-23-2020,Alabama,US,2020-03-23 23:19:34,0,0,0,,,1005,Barbour,31.868263,-85.3871286,0,"Barbour, Alabama, US"
03-23-2020,Alabama,US,2020-03-23 23:19:34,0,0,0,,,1007,Bibb,32.99642064,-87.1251146,0,"Bibb, Alabama, US"
03-23-2020,Alabama,US,2020-03-23 23:19:34,0,0,0,,,1009,Blount,33.98210918,-86.56790593,0,"Blount, Alabama, US"
03-23-2020,Alabama,US,2020-03-23 23:19:34,0,0,0,,,1011,Bullock,32.10030533,-85.71265535,0,"Bullock, Alabama, US"
03-23-2020,Alabama,US,2020-03-23 23:19:34,0,0,0,,,1013,Butler,31.75300095,-86.68057478,0,"Butler, Alabama, US"
03-23-2020,Alabama,US,2020-03-23 23:19:34,2,0,0,,,1015,Calhoun,33.77483727,-85.82630386,0,"Calhoun, Alabama, US"
03-23-2020,Alabama,US,2020-03-23 23:19:34,2,0,0,,,1017,Chambers,32.91360079,-85.39072749,0,"Chambers, Alabama, US"
03-23-2020,Alabama,US,2020-03-23 23:19:34,0,0,0,,,1019,Cherokee,34.17805983,-85.60638968,0,"Cherokee, Alabama, US"
03-23-2020,Alabama,US,2020-03-23 23:19:34,0,0,0,,,1021,Chilton,32.85044126,-86.7173256,0,"Chilton, Alabama, US"
03-23-2020,Alabama,US,2020-03-23 23:19:34,0,0,0,,,1023,Choctaw,32.02227341,-88.2656443,0,"Choctaw, Alabama, US"
03-23-2020,Alabama,US,2020-03-23 23:19:34,0,0,0,,,1025,Clarke,31.68099859,-87.83548597,0,"Clarke, Alabama, US"
03-23-2020,Alabama,US,2020-03-23 23:19:34,0,0,0,,,1027,Clay,33.26984193,-85.85836077,0,"Clay, Alabama, US"
03-23-2020,Alabama,US,2020-03-23 23:19:34,0,0,0,,,1029,Cleburne,33.67679204,-85.52005899,0,"Cleburne, Alabama, US"
03-23-2020,Alabama,US,2020-03-23 23:19:34,0,0,0,,,1031,Coffee,31.39932826,-85.98901039,0,"Coffee, Alabama, US"
03-23-2020,Alabama,US,2020-03-23 23:19:34,0,0,0,,,1033,Colbert,34.69847452,-87.80168544,0,"Colbert, Alabama, US"
03-23-2020,Alabama,US,2020-03-23 23:19:34,0,0,0,,,1035,Conecuh,31.43401703,-86.99320044,0,"Conecuh, Alabama, US"
03-23-2020,Alabama,US,2020-03-23 23:19:34,0,0,0,,,1037,Coosa,32.93690146,-86.24847739,0,"Coosa, Alabama, US"
03-23-2020,Alabama,US,2020-03-23 23:19:34,0,0,0,,,1039,Covington,31.2477854,-86.45050893,0,"Covington, Alabama, US"
03-23-2020,Alabama,US,2020-03-23 23:19:34,0,0,0,,,1041,Crenshaw,31.72941803,-86.31593104,0,"Crenshaw, Alabama, US"
03-23-2020,Alabama,US,2020-03-23 23:19:34,2,0,0,,,1043,Cullman,34.13020303,-86.86888037,0,"Cullman, Alabama, US"
03-23-2020,Alabama,US,2020-03-23 23:19:34,0,0,0,,,1045,Dale,31.43037123,-85.61095742,0,"Dale, Alabama, US"
03-23-2020,Alabama,US,2020-03-23 23:19:34,0,0,0,,,1047,Dallas,32.32688101,-87.1086671,0,"Dallas, Alabama, US"
03-23-2020,Alabama,US,2020-03-23 23:19:34,0,0,0,,,1049,DeKalb,34.45946862,-85.80782906,0,"DeKalb, Alabama, US"
03-23-2020,Alabama,US,2020-03-23 23:19:34,6,0,0,,,1051,Elmore,32.59785413,-86.14415284,0,"Elmore, Alabama, US"
03-23-2020,Alabama,US,2020-03-23 23:19:34,0,0,0,,,1053,Escambia,31.1256789,-87.15918694,0,"Escambia, Alabama, US"
03-23-2020,Alabama,US,2020-03-23 23:19:34,0,0,0,,,1055,Etowah,34.04567266,-86.04051873,0,"Etowah, Alabama, US"
03-23-2020,Alabama,US,2020-03-23 23:19:34,0,0,0,,,1057,Fayette,33.72076938,-87.73886638,0,"Fayette, Alabama, US"
03-23-2020,Alabama,US,2020-03-23 23:19:34,1,0,0,,,1059,Franklin,34.44235334,-87.84289505,0,"Franklin, Alabama, US"
03-23-2020,Alabama,US,2020-03-23 23:19:34,0,0,0,,,1061,Geneva,31.09389027,-85.83572839,0,"Geneva, Alabama, US"
03-23-2020,Alabama,US,2020-03-23 23:19:34,0,0,0,,,1063,Greene,32.85504247,-87.95684022,0,"Greene, Alabama, US"
03-23-2020,Alabama,US,2020-03-23 23:19:34,0,0,0,,,1065,Hale,32.76039258,-87.63284988,0,"Hale, Alabama, US"
03-23-2020,Alabama,US,2020-03-23 23:19:34,0,0,0,,,1067,Henry,31.51148016,-85.24267944,0,"Henry, Alabama, US"
03-23-2020,Alabama,US,2020-03-23 23:19:34,1,0,0,,,1069,Houston,31.15197924,-85.29939599,0,"Houston, Alabama, US"
03-23-2020,Alabama,US,2020-03-23 23:19:34,1,0,0,,,1071,Jackson,34.78144169,-85.99750489,0,"Jackson, Alabama, US"
03-23-2020,Alabama,US,2020-03-23 23:19:34,86,0,0,,,1073,Jefferson,33.55554728,-86.895063,0,"Jefferson, Alabama, US"
03-23-2020,Alabama,US,2020-03-23 23:19:34,1,0,0,,,1075,Lamar,33.77995024,-88.09668032,0,"Lamar, Alabama, US"
03-23-2020,Alabama,US,2020-03-23 23:19:34,3,0,0,,,1077,Lauderdale,34.90171875,-87.65624729,0,"Lauderdale, Alabama, US"
03-23-2020,Alabama,US,2020-03-23 23:19:34,0,0,0,,,1079,Lawrence,34.52041498,-87.31069453,0,"Lawrence, Alabama, US"
03-23-2020,Alabama,US,2020-03-23 23:19:34,19,0,0,,,1081,Lee,32.60154883,-85.35132246,0,"Lee, Alabama, US"
03-23-2020,Alabama,US,2020-03-23 23:19:34,1,0,0,,,1083,Limestone,34.81185586,-86.98310072,0,"Limestone, Alabama, US"
03-23-2020,Alabama,US,2020-03-23 23:19:34,0,0,0,,,1085,Lowndes,32.1597283,-86.65158371,0,"Lowndes, Alabama, US"
03-23-2020,Alabama,US,2020-03-23 23:19:34,0,0,0,,,1087,Macon,32.38759944,-85.69267724,0,"Macon, Alabama, US"
03-23-2020,Alabama,US,2020-03-23 23:19:34,21,0,0,,,1089,Madison,34.76327133,-86.55069633,0,"Madison, Alabama, US"
03-23-2020,Alabama,US,2020-03-23 23:19:34,0,0,0,,,1091,Marengo,32.24767634,-87.78796182,0,"Marengo, Alabama, US"
03-23-2020,Alabama,US,2020-03-23 23:19:34,1,0,0,,,1093,Marion,34.13697363,-87.88704173,0,"Marion, Alabama, US"
03-23-2020,Alabama,US,2020-03-23 23:19:34,0,0,0,,,1095,Marshall,34.36975964,-86.30486727,0,"Marshall, Alabama, US"
03-23-2020,Alabama,US,2020-03-23 23:19:34,2,0,0,,,1097,Mobile,30.78472347,-88.20842409,0,"Mobile, Alabama, US"
03-23-2020,Alabama,US,2020-03-23 23:19:34,0,0,0,,,1099,Monroe,31.56729412,-87.36995001,0,"Monroe, Alabama, US"
03-23-2020,Alabama,US,2020-03-23 23:19:34,4,0,0,,,1101,Montgomery,32.2206831,-86.20969272,0,"Montgomery, Alabama, US"
03-23-2020,Alabama,US,2020-03-23 23:19:34,0,0,0,,,1103,Morgan,34.45500589,-86.85475946,0,"Morgan, Alabama, US"
03-23-2020,Alabama,US,2020-03-23 23:19:34,0,0,0,,,1105,Perry,32.64048341,-87.29770589,0,"Perry, Alabama, US"
03-23-2020,Alabama,US,2020-03-23 23:19:34,0,0,0,,,1107,Pickens,33.28094866,-88.08818103,0,"Pickens, Alabama, US"
03-23-2020,Alabama,US,2020-03-23 23:19:34,0,0,0,,,1109,Pike,31.80396383,-85.9408295,0,"Pike, Alabama, US"
03-23-2020,Alabama,US,2020-03-23 23:19:34,0,0,0,,,1111,Randolph,33.29526734,-85.45708831,0,"Randolph, Alabama, US"
03-23-2020,Alabama,US,2020-03-23 23:19:34,0,0,0,,,1113,Russell,32.28725256,-85.18415324,0,"Russell, Alabama, US"
03-23-2020,Alabama,US,2020-03-23 23:19:34,22,0,0,,,1117,Shelby,33.26879845,-86.66232561,0,"Shelby, Alabama, US"
03-23-2020,Alabama,US,2020-03-23 23:19:34,3,0,0,,,1115,St. Clair,33.71902176,-86.31029372,0,"St. Clair, Alabama, US"
03-23-2020,Alabama,US,2020-03-23 23:19:34,0,0,0,,,1119,Sumter,32.59117397,-88.19916205,0,"Sumter, Alabama, US"
03-23-2020,Alabama,US,2020-03-23 23:19:34,1,0,0,,,1121,Talladega,33.37823223,-86.16886178,0,"Talladega, Alabama, US"
03-23-2020,Alabama,US,2020-03-23 23:19:34,1,0,0,,,1123,Tallapoosa,32.86698258,-85.79833053,0,"Tallapoosa, Alabama, US"
03-23-2020,Alabama,US,2020-03-23 23:19:34,9,0,0,,,1125,Tuscaloosa,33.28726072,-87.52556818,0,"Tuscaloosa, Alabama, US"
03-23-2020,Alabama,US,2020-03-23 23:19:34,3,0,0,,,1127,Walker,33.80270512,-87.30027177,0,"Walker, Alabama, US"
03-23-2020,Alabama,US,2020-03-23 23:19:34,1,0,0,,,1129,Washington,31.4092794,-88.20689944,0,"Washington, Alabama, US"
03-23-2020,Alabama,US,2020-03-23 23:19:34,0,0,0,,,1131,Wilcox,31.98773215,-87.30891118,0,"Wilcox, Alabama, US"
03-23-2020,Alabama,US,2020-03-23 23:19:34,0,0,0,,,1133,Winston,34.15030532,-87.37325922,0,"Winston, Alabama, US"
03-24-2020,Alabama,US,2020-03-24 23:37:31,1,0,0,,,1001,Autauga,32.53952745,-86.64408227,0,"Autauga, Alabama, US"
03-24-2020,Alabama,US,2020-03-24 23:37:31,4,0,0,,,1003,Baldwin,30.72774991,-87.72207058,0,"Baldwin, Alabama, US"
03-24-2020,Alabama,US,2020-03-24 23:37:31,0,0,0,,,1005,Barbour,31.868263,-85.3871286,0,"Barbour, Alabama, US"
03-24-2020,Alabama,US,2020-03-24 23:37:31,0,0,0,,,1007,Bibb,32.99642064,-87.1251146,0,"Bibb, Alabama, US"
03-24-2020,Alabama,US,2020-03-24 23:37:31,0,0,0,,,1009,Blount,33.98210918,-86.56790593,0,"Blount, Alabama, US"
03-24-2020,Alabama,US,2020-03-24 23:37:31,0,0,0,,,1011,Bullock,32.10030533,-85.71265535,0,"Bullock, Alabama, US"
03-24-2020,Alabama,US,2020-03-24 23:37:31,0,0,0,,,1013,Butler,31.75300095,-86.68057478,0,"Butler, Alabama, US"
03-24-2020,Alabama,US,2020-03-24 23:37:31,2,0,0,,,1015,Calhoun,33.77483727,-85.82630386,0,"Calhoun, Alabama, US"
03-24-2020,Alabama,US,2020-03-24 23:37:31,5,0,0,,,1017,Chambers,32.91360079,-85.39072749,0,"Chambers, Alabama, US"
03-24-2020,Alabama,US,2020-03-24 23:37:31,0,0,0,,,1019,Cherokee,34.17805983,-85.60638968,0,"Cherokee, Alabama, US"
03-24-2020,Alabama,US,2020-03-24 23:37:31,0,0,0,,,1021,Chilton,32.85044126,-86.7173256,0,"Chilton, Alabama, US"
03-24-2020,Alabama,US,2020-03-24 23:37:31,0,0,0,,,1023,Choctaw,32.02227341,-88.2656443,0,"Choctaw, Alabama, US"
03-24-2020,Alabama,US,2020-03-24 23:37:31,0,0,0,,,1025,Clarke,31.68099859,-87.83548597,0,"Clarke, Alabama, US"
03-24-2020,Alabama,US,2020-03-24 23:37:31,0,0,0,,,1027,Clay,33.26984193,-85.85836077,0,"Clay, Alabama, US"
03-24-2020,Alabama,US,2020-03-24 23:37:31,0,0,0,,,1029,Cleburne,33.67679204,-85.52005899,0,"Cleburne, Alabama, US"
03-24-2020,Alabama,US,2020-03-24 23:37:31,0,0,0,,,1031,Coffee,31.39932826,-85.98901039,0,"Coffee, Alabama, US"
03-24-2020,Alabama,US,2020-03-24 23:37:31,0,0,0,,,1033,Colbert,34.69847452,-87.80168544,0,"Colbert, Alabama, US"
03-24-2020,Alabama,US,2020-03-24 23:37:31,0,0,0,,,1035,Conecuh,31.43401703,-86.99320044,0,"Conecuh, Alabama, US"
03-24-2020,Alabama,US,2020-03-24 23:37:31,0,0,0,,,1037,Coosa,32.93690146,-86.24847739,0,"Coosa, Alabama, US"
03-24-2020,Alabama,US,2020-03-24 23:37:31,0,0,0,,,1039,Covington,31.2477854,-86.45050893,0,"Covington, Alabama, US"
03-24-2020,Alabama,US,2020-03-24 23:37:31,0,0,0,,,1041,Crenshaw,31.72941803,-86.31593104,0,"Crenshaw, Alabama, US"
03-24-2020,Alabama,US,2020-03-24 23:37:31,3,0,0,,,1043,Cullman,34.13020303,-86.86888037,0,"Cullman, Alabama, US"
03-24-2020,Alabama,US,2020-03-24 23:37:31,0,0,0,,,1045,Dale,31.43037123,-85.61095742,0,"Dale, Alabama, US"
03-24-2020,Alabama,US,2020-03-24 23:37:31,0,0,0,,,1047,Dallas,32.32688101,-87.1086671,0,"Dallas, Alabama, US"
03-24-2020,Alabama,US,2020-03-24 23:37:31,0,0,0,,,1049,DeKalb,34.45946862,-85.80782906,0,"DeKalb, Alabama, US"
03-24-2020,Alabama,US,2020-03-24 23:37:31,8,0,0,,,1051,Elmore,32.59785413,-86.14415284,0,"Elmore, Alabama, US"
03-24-2020,Alabama,US,2020-03-24 23:37:31,0,0,0,,,1053,Escambia,31.1256789,-87.15918694,0,"Escambia, Alabama, US"
03-24-2020,Alabama,US,2020-03-24 23:37:31,0,0,0,,,1055,Etowah,34.04567266,-86.04051873,0,"Etowah, Alabama, US"
03-24-2020,Alabama,US,2020-03-24 23:37:31,0,0,0,,,1057,Fayette,33.72076938,-87.73886638,0,"Fayette, Alabama, US"
03-24-2020,Alabama,US,2020-03-24 23:37:31,1,0,0,,,1059,Franklin,34.44235334,-87.84289505,0,"Franklin, Alabama, US"
03-24-2020,Alabama,US,2020-03-24 23:37:31,0,0,0,,,1061,Geneva,31.09389027,-85.83572839,0,"Geneva, Alabama, US"
03-24-2020,Alabama,US,2020-03-24 23:37:31,0,0,0,,,1063,Greene,32.85504247,-87.95684022,0,"Greene, Alabama, US"
03-24-2020,Alabama,US,2020-03-24 23:37:31,0,0,0,,,1065,Hale,32.76039258,-87.63284988,0,"Hale, Alabama, US"
03-24-2020,Alabama,US,2020-03-24 23:37:31,0,0,0,,,1067,Henry,31.51148016,-85.24267944,0,"Henry, Alabama, US"
03-24-2020,Alabama,US,2020-03-24 23:37:31,1,0,0,,,1069,Houston,31.15197924,-85.29939599,0,"Houston, Alabama, US"
03-24-2020,Alabama,US,2020-03-24 23:37:31,2,0,0,,,1071,Jackson,34.78144169,-85.99750489,0,"Jackson, Alabama, US"
03-24-2020,Alabama,US,2020-03-24 23:37:31,91,0,0,,,1073,Jefferson,33.55554728,-86.895063,0,"Jefferson, Alabama, US"
03-24-2020,Alabama,US,2020-03-24 23:37:31,1,0,0,,,1075,Lamar,33.77995024,-88.09668032,0,"Lamar, Alabama, US"
03-24-2020,Alabama,US,2020-03-24 23:37:31,3,0,0,,,1077,Lauderdale,34.90171875,-87.65624729,0,"Lauderdale, Alabama, US"
03-24-2020,Alabama,US,2020-03-24 23:37:31,0,0,0,,,1079,Lawrence,34.52041498,-87.31069453,0,"Lawrence, Alabama, US"
03-24-2020,Alabama,US,2020-03-24 23:37:31,26,0,0,,,1081,Lee,32.60154883,-85.35132246,0,"Lee, Alabama, US"
03-24-2020,Alabama,US,2020-03-24 23:37:31,4,0,0,,,1083,Limestone,34.81185586,-86.98310072,0,"Limestone, Alabama, US"
03-24-2020,Alabama,US,2020-03-24 23:37:31,0,0,0,,,1085,Lowndes,32.1597283,-86.65158371,0,"Lowndes, Alabama, US"
03-24-2020,Alabama,US,2020-03-24 23:37:31,0,0,0,,,1087,Macon,32.38759944,-85.69267724,0,"Macon, Alabama, US"
03-24-2020,Alabama,US,2020-03-24 23:37:31,21,0,0,,,1089,Madison,34.76327133,-86.55069633,0,"Madison, Alabama, US"
03-24-2020,Alabama,US,2020-03-24 23:37:31,0,0,0,,,1091,Marengo,32.24767634,-87.78796182,0,"Marengo, Alabama, US"
03-24-2020,Alabama,US,2020-03-24 23:37:31,1,0,0,,,1093,Marion,34.13697363,-87.88704173,0,"Marion, Alabama, US"
03-24-2020,Alabama,US,2020-03-24 23:37:31,0,0,0,,,1095,Marshall,34.36975964,-86.30486727,0,"Marshall, Alabama, US"
03-24-2020,Alabama,US,2020-03-24 23:37:31,6,0,0,,,1097,Mobile,30.78472347,-88.20842409,0,"Mobile, Alabama, US"
03-24-2020,Alabama,US,2020-03-24 23:37:31,0,0,0,,,1099,Monroe,31.56729412,-87.36995001,0,"Monroe, Alabama, US"
03-24-2020,Alabama,US,2020-03-24 23:37:31,9,0,0,,,1101,Montgomery,32.2206831,-86.20969272,0,"Montgomery, Alabama, US"
03-24-2020,Alabama,US,2020-03-24 23:37:31,2,0,0,,,1103,Morgan,34.45500589,-86.85475946,0,"Morgan, Alabama, US"
03-24-2020,Alabama,US,2020-03-24 23:37:31,0,0,0,,,1105,Perry,32.64048341,-87.29770589,0,"Perry, Alabama, US"
03-24-2020,Alabama,US,2020-03-24 23:37:31,0,0,0,,,1107,Pickens,33.28094866,-88.08818103,0,"Pickens, Alabama, US"
03-24-2020,Alabama,US,2020-03-24 23:37:31,0,0,0,,,1109,Pike,31.80396383,-85.9408295,0,"Pike, Alabama, US"
03-24-2020,Alabama,US,2020-03-24 23:37:31,0,0,0,,,1111,Randolph,33.29526734,-85.45708831,0,"Randolph, Alabama, US"
03-24-2020,Alabama,US,2020-03-24 23:37:31,0,0,0,,,1113,Russell,32.28725256,-85.18415324,0,"Russell, Alabama, US"
03-24-2020,Alabama,US,2020-03-24 23:37:31,27,0,0,,,1117,Shelby,33.26879845,-86.66232561,0,"Shelby, Alabama, US"
03-24-2020,Alabama,US,2020-03-24 23:37:31,4,0,0,,,1115,St. Clair,33.71902176,-86.31029372,0,"St. Clair, Alabama, US"
03-24-2020,Alabama,US,2020-03-24 23:37:31,0,0,0,,,1119,Sumter,32.59117397,-88.19916205,0,"Sumter, Alabama, US"
03-24-2020,Alabama,US,2020-03-24 23:37:31,2,0,0,,,1121,Talladega,33.37823223,-86.16886178,0,"Talladega, Alabama, US"
03-24-2020,Alabama,US,2020-03-24 23:37:31,2,0,0,,,1123,Tallapoosa,32.86698258,-85.79833053,0,"Tallapoosa, Alabama, US"
03-24-2020,Alabama,US,2020-03-24 23:37:31,10,0,0,,,1125,Tuscaloosa,33.28726072,-87.52556818,0,"Tuscaloosa, Alabama, US"
03-24-2020,Alabama,US,2020-03-24 23:37:31,5,0,0,,,1127,Walker,33.80270512,-87.30027177,0,"Walker, Alabama, US"
03-24-2020,Alabama,US,2020-03-24 23:37:31,1,0,0,,,1129,Washington,31.4092794,-88.20689944,0,"Washington, Alabama, US"
03-24-2020,Alabama,US,2020-03-24 23:37:31,0,0,0,,,1131,Wilcox,31.98773215,-87.30891118,0,"Wilcox, Alabama, US"
03-24-2020,Alabama,US,2020-03-24 23:37:31,0,0,0,,,1133,Winston,34.15030532,-87.37325922,0,"Winston, Alabama, US"
03-25-2020,Alabama,US,2020-03-25 23:33:19,4,0,0,,,1001,Autauga,32.53952745,-86.64408227,0,"Autauga, Alabama, US"
03-25-2020,Alabama,US,2020-03-25 23:33:19,4,0,0,,,1003,Baldwin,30.72774991,-87.72207058,0,"Baldwin, Alabama, US"
03-25-2020,Alabama,US,2020-03-25 23:33:19,0,0,0,,,1005,Barbour,31.868263,-85.3871286,0,"Barbour, Alabama, US"
03-25-2020,Alabama,US,2020-03-25 23:33:19,0,0,0,,,1007,Bibb,32.99642064,-87.1251146,0,"Bibb, Alabama, US"
03-25-2020,Alabama,US,2020-03-25 23:33:19,1,0,0,,,1009,Blount,33.98210918,-86.56790593,0,"Blount, Alabama, US"
03-25-2020,Alabama,US,2020-03-25 23:33:19,0,0,0,,,1011,Bullock,32.10030533,-85.71265535,0,"Bullock, Alabama, US"
03-25-2020,Alabama,US,2020-03-25 23:33:19,1,0,0,,,1013,Butler,31.75300095,-86.68057478,0,"Butler, Alabama, US"
03-25-2020,Alabama,US,2020-03-25 23:33:19,2,0,0,,,1015,Calhoun,33.77483727,-85.82630386,0,"Calhoun, Alabama, US"
03-25-2020,Alabama,US,2020-03-25 23:33:19,10,0,0,,,1017,Chambers,32.91360079,-85.39072749,0,"Chambers, Alabama, US"
03-25-2020,Alabama,US,2020-03-25 23:33:19,1,0,0,,,1019,Cherokee,34.17805983,-85.60638968,0,"Cherokee, Alabama, US"
03-25-2020,Alabama,US,2020-03-25 23:33:19,1,0,0,,,1021,Chilton,32.85044126,-86.7173256,0,"Chilton, Alabama, US"
03-25-2020,Alabama,US,2020-03-25 23:33:19,0,0,0,,,1023,Choctaw,32.02227341,-88.2656443,0,"Choctaw, Alabama, US"
03-25-2020,Alabama,US,2020-03-25 23:33:19,0,0,0,,,1025,Clarke,31.68099859,-87.83548597,0,"Clarke, Alabama, US"
03-25-2020,Alabama,US,2020-03-25 23:33:19,1,0,0,,,1027,Clay,33.26984193,-85.85836077,0,"Clay, Alabama, US"
03-25-2020,Alabama,US,2020-03-25 23:33:19,1,0,0,,,1029,Cleburne,33.67679204,-85.52005899,0,"Cleburne, Alabama, US"
03-25-2020,Alabama,US,2020-03-25 23:33:19,0,0,0,,,1031,Coffee,31.39932826,-85.98901039,0,"Coffee, Alabama, US"
03-25-2020,Alabama,US,2020-03-25 23:33:19,1,0,0,,,1033,Colbert,34.69847452,-87.80168544,0,"Colbert, Alabama, US"
03-25-2020,Alabama,US,2020-03-25 23:33:19,0,0,0,,,1035,Conecuh,31.43401703,-86.99320044,0,"Conecuh, Alabama, US"
03-25-2020,Alabama,US,2020-03-25 23:33:19,0,0,0,,,1037,Coosa,32.93690146,-86.24847739,0,"Coosa, Alabama, US"
03-25-2020,Alabama,US,2020-03-25 23:33:19,0,0,0,,,1039,Covington,31.2477854,-86.45050893,0,"Covington, Alabama, US"
03-25-2020,Alabama,US,2020-03-25 23:33:19,0,0,0,,,1041,Crenshaw,31.72941803,-86.31593104,0,"Crenshaw, Alabama, US"
03-25-2020,Alabama,US,2020-03-25 23:33:19,4,0,0,,,1043,Cullman,34.13020303,-86.86888037,0,"Cullman, Alabama, US"
03-25-2020,Alabama,US,2020-03-25 23:33:19,0,0,0,,,1045,Dale,31.43037123,-85.61095742,0,"Dale, Alabama, US"
03-25-2020,Alabama,US,2020-03-25 23:33:19,2,0,0,,,1047,Dallas,32.32688101,-87.1086671,0,"Dallas, Alabama, US"
03-25-2020,Alabama,US,2020-03-25 23:33:19,0,0,0,,,1049,DeKalb,34.45946862,-85.80782906,0,"DeKalb, Alabama, US"
03-25-2020,Alabama,US,2020-03-25 23:33:19,9,0,0,,,1051,Elmore,32.59785413,-86.14415284,0,"Elmore, Alabama, US"
03-25-2020,Alabama,US,2020-03-25 23:33:19,0,0,0,,,1053,Escambia,31.1256789,-87.15918694,0,"Escambia, Alabama, US"
03-25-2020,Alabama,US,2020-03-25 23:33:19,0,0,0,,,1055,Etowah,34.04567266,-86.04051873,0,"Etowah, Alabama, US"
03-25-2020,Alabama,US,2020-03-25 23:33:19,0,0,0,,,1057,Fayette,33.72076938,-87.73886638,0,"Fayette, Alabama, US"
03-25-2020,Alabama,US,2020-03-25 23:33:19,2,0,0,,,1059,Franklin,34.44235334,-87.84289505,0,"Franklin, Alabama, US"
03-25-2020,Alabama,US,2020-03-25 23:33:19,0,0,0,,,1061,Geneva,31.09389027,-85.83572839,0,"Geneva, Alabama, US"
03-25-2020,Alabama,US,2020-03-25 23:33:19,0,0,0,,,1063,Greene,32.85504247,-87.95684022,0,"Greene, Alabama, US"
03-25-2020,Alabama,US,2020-03-25 23:33:19,0,0,0,,,1065,Hale,32.76039258,-87.63284988,0,"Hale, Alabama, US"
03-25-2020,Alabama,US,2020-03-25 23:33:19,0,0,0,,,1067,Henry,31.51148016,-85.24267944,0,"Henry, Alabama, US"
03-25-2020,Alabama,US,2020-03-25 23:33:19,2,0,0,,,1069,Houston,31.15197924,-85.29939599,0,"Houston, Alabama, US"
03-25-2020,Alabama,US,2020-03-25 23:33:19,2,1,0,,,1071,Jackson,34.78144169,-85.99750489,0,"Jackson, Alabama, US"
03-25-2020,Alabama,US,2020-03-25 23:33:19,129,0,0,,,1073,Jefferson,33.55554728,-86.895063,0,"Jefferson, Alabama, US"
03-25-2020,Alabama,US,2020-03-25 23:33:19,1,0,0,,,1075,Lamar,33.77995024,-88.09668032,0,"Lamar, Alabama, US"
03-25-2020,Alabama,US,2020-03-25 23:33:19,6,0,0,,,1077,Lauderdale,34.90171875,-87.65624729,0,"Lauderdale, Alabama, US"
03-25-2020,Alabama,US,2020-03-25 23:33:19,0,0,0,,,1079,Lawrence,34.52041498,-87.31069453,0,"Lawrence, Alabama, US"
03-25-2020,Alabama,US,2020-03-25 23:33:19,40,0,0,,,1081,Lee,32.60154883,-85.35132246,0,"Lee, Alabama, US"
03-25-2020,Alabama,US,2020-03-25 23:33:19,6,0,0,,,1083,Limestone,34.81185586,-86.98310072,0,"Limestone, Alabama, US"
03-25-2020,Alabama,US,2020-03-25 23:33:19,0,0,0,,,1085,Lowndes,32.1597283,-86.65158371,0,"Lowndes, Alabama, US"
03-25-2020,Alabama,US,2020-03-25 23:33:19,0,0,0,,,1087,Macon,32.38759944,-85.69267724,0,"Macon, Alabama, US"
03-25-2020,Alabama,US,2020-03-25 23:33:19,35,0,0,,,1089,Madison,34.76327133,-86.55069633,0,"Madison, Alabama, US"
03-25-2020,Alabama,US,2020-03-25 23:33:19,0,0,0,,,1091,Marengo,32.24767634,-87.78796182,0,"Marengo, Alabama, US"
03-25-2020,Alabama,US,2020-03-25 23:33:19,3,0,0,,,1093,Marion,34.13697363,-87.88704173,0,"Marion, Alabama, US"
03-25-2020,Alabama,US,2020-03-25 23:33:19,1,0,0,,,1095,Marshall,34.36975964,-86.30486727,0,"Marshall, Alabama, US"
03-25-2020,Alabama,US,2020-03-25 23:33:19,10,0,0,,,1097,Mobile,30.78472347,-88.20842409,0,"Mobile, Alabama, US"
03-25-2020,Alabama,US,2020-03-25 23:33:19,0,0,0,,,1099,Monroe,31.56729412,-87.36995001,0,"Monroe, Alabama, US"
03-25-2020,Alabama,US,2020-03-25 23:33:19,13,0,0,,,1101,Montgomery,32.2206831,-86.20969272,0,"Montgomery, Alabama, US"
03-25-2020,Alabama,US,2020-03-25 23:33:19,5,0,0,,,1103,Morgan,34.45500589,-86.85475946,0,"Morgan, Alabama, US"
03-25-2020,Alabama,US,2020-03-25 23:33:19,0,0,0,,,1105,Perry,32.64048341,-87.29770589,0,"Perry, Alabama, US"
03-25-2020,Alabama,US,2020-03-25 23:33:19,1,0,0,,,1107,Pickens,33.28094866,-88.08818103,0,"Pickens, Alabama, US"
03-25-2020,Alabama,US,2020-03-25 23:33:19,1,0,0,,,1109,Pike,31.80396383,-85.9408295,0,"Pike, Alabama, US"
03-25-2020,Alabama,US,2020-03-25 23:33:19,0,0,0,,,1111,Randolph,33.29526734,-85.45708831,0,"Randolph, Alabama, US"
03-25-2020,Alabama,US,2020-03-25 23:33:19,1,0,0,,,1113,Russell,32.28725256,-85.18415324,0,"Russell, Alabama, US"
03-25-2020,Alabama,US,2020-03-25 23:33:19,42,0,0,,,1117,Shelby,33.26879845,-86.66232561,0,"Shelby, Alabama, US"
03-25-2020,Alabama,US,2020-03-25 23:33:19,6,0,0,,,1115,St. Clair,33.71902176,-86.31029372,0,"St. Clair, Alabama, US"
03-25-2020,Alabama,US,2020-03-25 23:33:19,0,0,0,,,1119,Sumter,32.59117397,-88.19916205,0,"Sumter, Alabama, US"
03-25-2020,Alabama,US,2020-03-25 23:33:19,3,0,0,,,1121,Talladega,33.37823223,-86.16886178,0,"Talladega, Alabama, US"
03-25-2020,Alabama,US,2020-03-25 23:33:19,4,0,0,,,1123,Tallapoosa,32.86698258,-85.79833053,0,"Tallapoosa, Alabama, US"
03-25-2020,Alabama,US,2020-03-25 23:33:19,15,0,0,,,1125,Tuscaloosa,33.28726072,-87.52556818,0,"Tuscaloosa, Alabama, US"
03-25-2020,Alabama,US,2020-03-25 23:33:19,9,0,0,,,1127,Walker,33.80270512,-87.30027177,0,"Walker, Alabama, US"
03-25-2020,Alabama,US,2020-03-25 23:33:19,1,0,0,,,1129,Washington,31.4092794,-88.20689944,0,"Washington, Alabama, US"
03-25-2020,Alabama,US,2020-03-25 23:33:19,1,0,0,,,1131,Wilcox,31.98773215,-87.30891118,0,"Wilcox, Alabama, US"
03-25-2020,Alabama,US,2020-03-25 23:33:19,0,0,0,,,1133,Winston,34.15030532,-87.37325922,0,"Winston, Alabama, US"
03-26-2020,Alabama,US,2020-03-26 23:48:35,6,0,0,,,1001,Autauga,32.53952745,-86.64408227,0,"Autauga, Alabama, US"
03-26-2020,Alabama,US,2020-03-26 23:48:35,5,0,0,,,1003,Baldwin,30.72774991,-87.72207058,0,"Baldwin, Alabama, US"
03-26-2020,Alabama,US,2020-03-26 23:48:35,0,0,0,,,1005,Barbour,31.868263,-85.3871286,0,"Barbour, Alabama, US"
03-26-2020,Alabama,US,2020-03-26 23:48:35,0,0,0,,,1007,Bibb,32.99642064,-87.1251146,0,"Bibb, Alabama, US"
03-26-2020,Alabama,US,2020-03-26 23:48:35,2,0,0,,,1009,Blount,33.98210918,-86.56790593,0,"Blount, Alabama, US"
03-26-2020,Alabama,US,2020-03-26 23:48:35,2,0,0,,,1011,Bullock,32.10030533,-85.71265535,0,"Bullock, Alabama, US"
03-26-2020,Alabama,US,2020-03-26 23:48:35,1,0,0,,,1013,Butler,31.75300095,-86.68057478,0,"Butler, Alabama, US"
03-26-2020,Alabama,US,2020-03-26 23:48:35,2,0,0,,,1015,Calhoun,33.77483727,-85.82630386,0,"Calhoun, Alabama, US"
03-26-2020,Alabama,US,2020-03-26 23:48:35,13,0,0,,,1017,Chambers,32.91360079,-85.39072749,0,"Chambers, Alabama, US"
03-26-2020,Alabama,US,2020-03-26 23:48:35,1,0,0,,,1019,Cherokee,34.17805983,-85.60638968,0,"Cherokee, Alabama, US"
03-26-2020,Alabama,US,2020-03-26 23:48:35,4,0,0,,,1021,Chilton,32.85044126,-86.7173256,0,"Chilton, Alabama, US"
03-26-2020,Alabama,US,2020-03-26 23:48:35,1,0,0,,,1023,Choctaw,32.02227341,-88.2656443,0,"Choctaw, Alabama, US"
03-26-2020,Alabama,US,2020-03-26 23:48:35,0,0,0,,,1025,Clarke,31.68099859,-87.83548597,0,"Clarke, Alabama, US"
03-26-2020,Alabama,US,2020-03-26 23:48:35,1,0,0,,,1027,Clay,33.26984193,-85.85836077,0,"Clay, Alabama, US"
03-26-2020,Alabama,US,2020-03-26 23:48:35,1,0,0,,,1029,Cleburne,33.67679204,-85.52005899,0,"Cleburne, Alabama, US"
03-26-2020,Alabama,US,2020-03-26 23:48:35,1,0,0,,,1031,Coffee,31.39932826,-85.98901039,0,"Coffee, Alabama, US"
03-26-2020,Alabama,US,2020-03-26 23:48:35,1,0,0,,,1033,Colbert,34.69847452,-87.80168544,0,"Colbert, Alabama, US"
03-26-2020,Alabama,US,2020-03-26 23:48:35,0,0,0,,,1035,Conecuh,31.43401703,-86.99320044,0,"Conecuh, Alabama, US"
03-26-2020,Alabama,US,2020-03-26 23:48:35,2,0,0,,,1037,Coosa,32.93690146,-86.24847739,0,"Coosa, Alabama, US"
03-26-2020,Alabama,US,2020-03-26 23:48:35,0,0,0,,,1039,Covington,31.2477854,-86.45050893,0,"Covington, Alabama, US"
03-26-2020,Alabama,US,2020-03-26 23:48:35,0,0,0,,,1041,Crenshaw,31.72941803,-86.31593104,0,"Crenshaw, Alabama, US"
03-26-2020,Alabama,US,2020-03-26 23:48:35,6,0,0,,,1043,Cullman,34.13020303,-86.86888037,0,"Cullman, Alabama, US"
03-26-2020,Alabama,US,2020-03-26 23:48:35,0,0,0,,,1045,Dale,31.43037123,-85.61095742,0,"Dale, Alabama, US"
03-26-2020,Alabama,US,2020-03-26 23:48:35,2,0,0,,,1047,Dallas,32.32688101,-87.1086671,0,"Dallas, Alabama, US"
03-26-2020,Alabama,US,2020-03-26 23:48:35,1,0,0,,,1049,DeKalb,34.45946862,-85.80782906,0,"DeKalb, Alabama, US"
03-26-2020,Alabama,US,2020-03-26 23:48:35,10,0,0,,,1051,Elmore,32.59785413,-86.14415284,0,"Elmore, Alabama, US"
03-26-2020,Alabama,US,2020-03-26 23:48:35,0,0,0,,,1053,Escambia,31.1256789,-87.15918694,0,"Escambia, Alabama, US"
03-26-2020,Alabama,US,2020-03-26 23:48:35,4,0,0,,,1055,Etowah,34.04567266,-86.04051873,0,"Etowah, Alabama, US"
03-26-2020,Alabama,US,2020-03-26 23:48:35,0,0,0,,,1057,Fayette,33.72076938,-87.73886638,0,"Fayette, Alabama, US"
03-26-2020,Alabama,US,2020-03-26 23:48:35,3,0,0,,,1059,Franklin,34.44235334,-87.84289505,0,"Franklin, Alabama, US"
03-26-2020,Alabama,US,2020-03-26 23:48:35,0,0,0,,,1061,Geneva,31.09389027,-85.83572839,0,"Geneva, Alabama, US"
03-26-2020,Alabama,US,2020-03-26 23:48:35,0,0,0,,,1063,Greene,32.85504247,-87.95684022,0,"Greene, Alabama, US"
03-26-2020,Alabama,US,2020-03-26 23:48:35,0,0,0,,,1065,Hale,32.76039258,-87.63284988,0,"Hale, Alabama, US"
03-26-2020,Alabama,US,2020-03-26 23:48:35,0,0,0,,,1067,Henry,31.51148016,-85.24267944,0,"Henry, Alabama, US"
03-26-2020,Alabama,US,2020-03-26 23:48:35,3,0,0,,,1069,Houston,31.15197924,-85.29939599,0,"Houston, Alabama, US"
03-26-2020,Alabama,US,2020-03-26 23:48:35,4,1,0,,,1071,Jackson,34.78144169,-85.99750489,0,"Jackson, Alabama, US"
03-26-2020,Alabama,US,2020-03-26 23:48:35,159,0,0,,,1073,Jefferson,33.55554728,-86.895063,0,"Jefferson, Alabama, US"
03-26-2020,Alabama,US,2020-03-26 23:48:35,1,0,0,,,1075,Lamar,33.77995024,-88.09668032,0,"Lamar, Alabama, US"
03-26-2020,Alabama,US,2020-03-26 23:48:35,9,0,0,,,1077,Lauderdale,34.90171875,-87.65624729,0,"Lauderdale, Alabama, US"
03-26-2020,Alabama,US,2020-03-26 23:48:35,3,0,0,,,1079,Lawrence,34.52041498,-87.31069453,0,"Lawrence, Alabama, US"
03-26-2020,Alabama,US,2020-03-26 23:48:35,47,0,0,,,1081,Lee,32.60154883,-85.35132246,0,"Lee, Alabama, US"
03-26-2020,Alabama,US,2020-03-26 23:48:35,13,0,0,,,1083,Limestone,34.81185586,-86.98310072,0,"Limestone, Alabama, US"
03-26-2020,Alabama,US,2020-03-26 23:48:35,1,0,0,,,1085,Lowndes,32.1597283,-86.65158371,0,"Lowndes, Alabama, US"
03-26-2020,Alabama,US,2020-03-26 23:48:35,0,0,0,,,1087,Macon,32.38759944,-85.69267724,0,"Macon, Alabama, US"
03-26-2020,Alabama,US,2020-03-26 23:48:35,43,0,0,,,1089,Madison,34.76327133,-86.55069633,0,"Madison, Alabama, US"
03-26-2020,Alabama,US,2020-03-26 23:48:35,1,0,0,,,1091,Marengo,32.24767634,-87.78796182,0,"Marengo, Alabama, US"
03-26-2020,Alabama,US,2020-03-26 23:48:35,7,0,0,,,1093,Marion,34.13697363,-87.88704173,0,"Marion, Alabama, US"
03-26-2020,Alabama,US,2020-03-26 23:48:35,3,0,0,,,1095,Marshall,34.36975964,-86.30486727,0,"Marshall, Alabama, US"
03-26-2020,Alabama,US,2020-03-26 23:48:35,18,0,0,,,1097,Mobile,30.78472347,-88.20842409,0,"Mobile, Alabama, US"
03-26-2020,Alabama,US,2020-03-26 23:48:35,0,0,0,,,1099,Monroe,31.56729412,-87.36995001,0,"Monroe, Alabama, US"
03-26-2020,Alabama,US,2020-03-26 23:48:35,17,0,0,,,1101,Montgomery,32.2206831,-86.20969272,0,"Montgomery, Alabama, US"
03-26-2020,Alabama,US,2020-03-26 23:48:35,9,0,0,,,1103,Morgan,34.45500589,-86.85475946,0,"Morgan, Alabama, US"
03-26-2020,Alabama,US,2020-03-26 23:48:35,0,0,0,,,1105,Perry,32.64048341,-87.29770589,0,"Perry, Alabama, US"
03-26-2020,Alabama,US,2020-03-26 23:48:35,1,0,0,,,1107,Pickens,33.28094866,-88.08818103,0,"Pickens, Alabama, US"
03-26-2020,Alabama,US,2020-03-26 23:48:35,2,0,0,,,1109,Pike,31.80396383,-85.9408295,0,"Pike, Alabama, US"
03-26-2020,Alabama,US,2020-03-26 23:48:35,0,0,0,,,1111,Randolph,33.29526734,-85.45708831,0,"Randolph, Alabama, US"
03-26-2020,Alabama,US,2020-03-26 23:48:35,1,0,0,,,1113,Russell,32.28725256,-85.18415324,0,"Russell, Alabama, US"
03-26-2020,Alabama,US,2020-03-26 23:48:35,52,0,0,,,1117,Shelby,33.26879845,-86.66232561,0,"Shelby, Alabama, US"
03-26-2020,Alabama,US,2020-03-26 23:48:35,6,0,0,,,1115,St. Clair,33.71902176,-86.31029372,0,"St. Clair, Alabama, US"
03-26-2020,Alabama,US,2020-03-26 23:48:35,0,0,0,,,1119,Sumter,32.59117397,-88.19916205,0,"Sumter, Alabama, US"
03-26-2020,Alabama,US,2020-03-26 23:48:35,4,0,0,,,1121,Talladega,33.37823223,-86.16886178,0,"Talladega, Alabama, US"
03-26-2020,Alabama,US,2020-03-26 23:48:35,4,0,0,,,1123,Tallapoosa,32.86698258,-85.79833053,0,"Tallapoosa, Alabama, US"
03-26-2020,Alabama,US,2020-03-26 23:48:35,19,0,0,,,1125,Tuscaloosa,33.28726072,-87.52556818,0,"Tuscaloosa, Alabama, US"
03-26-2020,Alabama,US,2020-03-26 23:48:35,17,0,0,,,1127,Walker,33.80270512,-87.30027177,0,"Walker, Alabama, US"
03-26-2020,Alabama,US,2020-03-26 23:48:35,2,0,0,,,1129,Washington,31.4092794,-88.20689944,0,"Washington, Alabama, US"
03-26-2020,Alabama,US,2020-03-26 23:48:35,2,0,0,,,1131,Wilcox,31.98773215,-87.30891118,0,"Wilcox, Alabama, US"
03-26-2020,Alabama,US,2020-03-26 23:48:35,0,0,0,,,1133,Winston,34.15030532,-87.37325922,0,"Winston, Alabama, US"
03-27-2020,Alabama,US,2020-03-27 22:14:55,6,0,0,,,1001,Autauga,32.53952745,-86.64408227,0,"Autauga, Alabama, US"
03-27-2020,Alabama,US,2020-03-27 22:14:55,5,0,0,,,1003,Baldwin,30.72774991,-87.72207058,0,"Baldwin, Alabama, US"
03-27-2020,Alabama,US,2020-03-27 22:14:55,0,0,0,,,1005,Barbour,31.868263,-85.3871286,0,"Barbour, Alabama, US"
03-27-2020,Alabama,US,2020-03-27 22:14:55,0,0,0,,,1007,Bibb,32.99642064,-87.1251146,0,"Bibb, Alabama, US"
03-27-2020,Alabama,US,2020-03-27 22:14:55,4,0,0,,,1009,Blount,33.98210918,-86.56790593,0,"Blount, Alabama, US"
03-27-2020,Alabama,US,2020-03-27 22:14:55,2,0,0,,,1011,Bullock,32.10030533,-85.71265535,0,"Bullock, Alabama, US"
03-27-2020,Alabama,US,2020-03-27 22:14:55,1,0,0,,,1013,Butler,31.75300095,-86.68057478,0,"Butler, Alabama, US"
03-27-2020,Alabama,US,2020-03-27 22:14:55,3,0,0,,,1015,Calhoun,33.77483727,-85.82630386,0,"Calhoun, Alabama, US"
03-27-2020,Alabama,US,2020-03-27 22:14:55,13,0,0,,,1017,Chambers,32.91360079,-85.39072749,0,"Chambers, Alabama, US"
03-27-2020,Alabama,US,2020-03-27 22:14:55,1,0,0,,,1019,Cherokee,34.17805983,-85.60638968,0,"Cherokee, Alabama, US"
03-27-2020,Alabama,US,2020-03-27 22:14:55,6,0,0,,,1021,Chilton,32.85044126,-86.7173256,0,"Chilton, Alabama, US"
03-27-2020,Alabama,US,2020-03-27 22:14:55,1,0,0,,,1023,Choctaw,32.02227341,-88.2656443,0,"Choctaw, Alabama, US"
03-27-2020,Alabama,US,2020-03-27 22:14:55,0,0,0,,,1025,Clarke,31.68099859,-87.83548597,0,"Clarke, Alabama, US"
03-27-2020,Alabama,US,2020-03-27 22:14:55,1,0,0,,,1027,Clay,33.26984193,-85.85836077,0,"Clay, Alabama, US"
03-27-2020,Alabama,US,2020-03-27 22:14:55,3,0,0,,,1029,Cleburne,33.67679204,-85.52005899,0,"Cleburne, Alabama, US"
03-27-2020,Alabama,US,2020-03-27 22:14:55,0,0,0,,,1031,Coffee,31.39932826,-85.98901039,0,"Coffee, Alabama, US"
03-27-2020,Alabama,US,2020-03-27 22:14:55,1,0,0,,,1033,Colbert,34.69847452,-87.80168544,0,"Colbert, Alabama, US"
03-27-2020,Alabama,US,2020-03-27 22:14:55,0,0,0,,,1035,Conecuh,31.43401703,-86.99320044,0,"Conecuh, Alabama, US"
03-27-2020,Alabama,US,2020-03-27 22:14:55,2,0,0,,,1037,Coosa,32.93690146,-86.24847739,0,"Coosa, Alabama, US"
03-27-2020,Alabama,US,2020-03-27 22:14:55,1,0,0,,,1039,Covington,31.2477854,-86.45050893,0,"Covington, Alabama, US"
03-27-2020,Alabama,US,2020-03-27 22:14:55,1,0,0,,,1041,Crenshaw,31.72941803,-86.31593104,0,"Crenshaw, Alabama, US"
03-27-2020,Alabama,US,2020-03-27 22:14:55,6,0,0,,,1043,Cullman,34.13020303,-86.86888037,0,"Cullman, Alabama, US"
03-27-2020,Alabama,US,2020-03-27 22:14:55,0,0,0,,,1045,Dale,31.43037123,-85.61095742,0,"Dale, Alabama, US"
03-27-2020,Alabama,US,2020-03-27 22:14:55,2,0,0,,,1047,Dallas,32.32688101,-87.1086671,0,"Dallas, Alabama, US"
03-27-2020,Alabama,US,2020-03-27 22:14:55,1,0,0,,,1049,DeKalb,34.45946862,-85.80782906,0,"DeKalb, Alabama, US"
03-27-2020,Alabama,US,2020-03-27 22:14:55,12,0,0,,,1051,Elmore,32.59785413,-86.14415284,0,"Elmore, Alabama, US"
03-27-2020,Alabama,US,2020-03-27 22:14:55,0,0,0,,,1053,Escambia,31.1256789,-87.15918694,0,"Escambia, Alabama, US"
03-27-2020,Alabama,US,2020-03-27 22:14:55,4,0,0,,,1055,Etowah,34.04567266,-86.04051873,0,"Etowah, Alabama, US"
03-27-2020,Alabama,US,2020-03-27 22:14:55,0,0,0,,,1057,Fayette,33.72076938,-87.73886638,0,"Fayette, Alabama, US"
03-27-2020,Alabama,US,2020-03-27 22:14:55,3,0,0,,,1059,Franklin,34.44235334,-87.84289505,0,"Franklin, Alabama, US"
03-27-2020,Alabama,US,2020-03-27 22:14:55,0,0,0,,,1061,Geneva,31.09389027,-85.83572839,0,"Geneva, Alabama, US"
03-27-2020,Alabama,US,2020-03-27 22:14:55,1,0,0,,,1063,Greene,32.85504247,-87.95684022,0,"Greene, Alabama, US"
03-27-2020,Alabama,US,2020-03-27 22:14:55,0,0,0,,,1065,Hale,32.76039258,-87.63284988,0,"Hale, Alabama, US"
03-27-2020,Alabama,US,2020-03-27 22:14:55,0,0,0,,,1067,Henry,31.51148016,-85.24267944,0,"Henry, Alabama, US"
03-27-2020,Alabama,US,2020-03-27 22:14:55,3,0,0,,,1069,Houston,31.15197924,-85.29939599,0,"Houston, Alabama, US"
03-27-2020,Alabama,US,2020-03-27 22:14:55,4,1,0,,,1071,Jackson,34.78144169,-85.99750489,0,"Jackson, Alabama, US"
03-27-2020,Alabama,US,2020-03-27 22:14:55,177,0,0,,,1073,Jefferson,33.55554728,-86.895063,0,"Jefferson, Alabama, US"
03-27-2020,Alabama,US,2020-03-27 22:14:55,1,0,0,,,1075,Lamar,33.77995024,-88.09668032,0,"Lamar, Alabama, US"
03-27-2020,Alabama,US,2020-03-27 22:14:55,9,1,0,,,1077,Lauderdale,34.90171875,-87.65624729,0,"Lauderdale, Alabama, US"
03-27-2020,Alabama,US,2020-03-27 22:14:55,2,0,0,,,1079,Lawrence,34.52041498,-87.31069453,0,"Lawrence, Alabama, US"
03-27-2020,Alabama,US,2020-03-27 22:14:55,48,0,0,,,1081,Lee,32.60154883,-85.35132246,0,"Lee, Alabama, US"
03-27-2020,Alabama,US,2020-03-27 22:14:55,14,0,0,,,1083,Limestone,34.81185586,-86.98310072,0,"Limestone, Alabama, US"
03-27-2020,Alabama,US,2020-03-27 22:14:55,1,0,0,,,1085,Lowndes,32.1597283,-86.65158371,0,"Lowndes, Alabama, US"
03-27-2020,Alabama,US,2020-03-27 22:14:55,0,0,0,,,1087,Macon,32.38759944,-85.69267724,0,"Macon, Alabama, US"
03-27-2020,Alabama,US,2020-03-27 22:14:55,47,1,0,,,1089,Madison,34.76327133,-86.55069633,0,"Madison, Alabama, US"
03-27-2020,Alabama,US,2020-03-27 22:14:55,2,0,0,,,1091,Marengo,32.24767634,-87.78796182,0,"Marengo, Alabama, US"
03-27-2020,Alabama,US,2020-03-27 22:14:55,7,0,0,,,1093,Marion,34.13697363,-87.88704173,0,"Marion, Alabama, US"
03-27-2020,Alabama,US,2020-03-27 22:14:55,4,0,0,,,1095,Marshall,34.36975964,-86.30486727,0,"Marshall, Alabama, US"
03-27-2020,Alabama,US,2020-03-27 22:14:55,23,1,0,,,1097,Mobile,30.78472347,-88.20842409,0,"Mobile, Alabama, US"
03-27-2020,Alabama,US,2020-03-27 22:14:55,0,0,0,,,1099,Monroe,31.56729412,-87.36995001,0,"Monroe, Alabama, US"
03-27-2020,Alabama,US,2020-03-27 22:14:55,18,0,0,,,1101,Montgomery,32.2206831,-86.20969272,0,"Montgomery, Alabama, US"
03-27-2020,Alabama,US,2020-03-27 22:14:55,9,0,0,,,1103,Morgan,34.45500589,-86.85475946,0,"Morgan, Alabama, US"
03-27-2020,Alabama,US,2020-03-27 22:14:55,0,0,0,,,1105,Perry,32.64048341,-87.29770589,0,"Perry, Alabama, US"
03-27-2020,Alabama,US,2020-03-27 22:14:55,1,0,0,,,1107,Pickens,33.28094866,-88.08818103,0,"Pickens, Alabama, US"
03-27-2020,Alabama,US,2020-03-27 22:14:55,2,0,0,,,1109,Pike,31.80396383,-85.9408295,0,"Pike, Alabama, US"
03-27-2020,Alabama,US,2020-03-27 22:14:55,1,0,0,,,1111,Randolph,33.29526734,-85.45708831,0,"Randolph, Alabama, US"
03-27-2020,Alabama,US,2020-03-27 22:14:55,1,0,0,,,1113,Russell,32.28725256,-85.18415324,0,"Russell, Alabama, US"
03-27-2020,Alabama,US,2020-03-27 22:14:55,66,0,0,,,1117,Shelby,33.26879845,-86.66232561,0,"Shelby, Alabama, US"
03-27-2020,Alabama,US,2020-03-27 22:14:55,9,0,0,,,1115,St. Clair,33.71902176,-86.31029372,0,"St. Clair, Alabama, US"
03-27-2020,Alabama,US,2020-03-27 22:14:55,0,0,0,,,1119,Sumter,32.59117397,-88.19916205,0,"Sumter, Alabama, US"
03-27-2020,Alabama,US,2020-03-27 22:14:55,4,0,0,,,1121,Talladega,33.37823223,-86.16886178,0,"Talladega, Alabama, US"
03-27-2020,Alabama,US,2020-03-27 22:14:55,4,0,0,,,1123,Tallapoosa,32.86698258,-85.79833053,0,"Tallapoosa, Alabama, US"
03-27-2020,Alabama,US,2020-03-27 22:14:55,21,0,0,,,1125,Tuscaloosa,33.28726072,-87.52556818,0,"Tuscaloosa, Alabama, US"
03-27-2020,Alabama,US,2020-03-27 22:14:55,23,0,0,,,1127,Walker,33.80270512,-87.30027177,0,"Walker, Alabama, US"
03-27-2020,Alabama,US,2020-03-27 22:14:55,2,0,0,,,1129,Washington,31.4092794,-88.20689944,0,"Washington, Alabama, US"
03-27-2020,Alabama,US,2020-03-27 22:14:55,2,0,0,,,1131,Wilcox,31.98773215,-87.30891118,0,"Wilcox, Alabama, US"
03-27-2020,Alabama,US,2020-03-27 22:14:55,2,0,0,,,1133,Winston,34.15030532,-87.37325922,0,"Winston, Alabama, US"
03-28-2020,Alabama,US,2020-03-28 23:05:37,6,0,0,,,1001,Autauga,32.53952745,-86.64408227,0,"Autauga, Alabama, US"
03-28-2020,Alabama,US,2020-03-28 23:05:37,10,0,0,,,1003,Baldwin,30.72774991,-87.72207058,0,"Baldwin, Alabama, US"
03-28-2020,Alabama,US,2020-03-28 23:05:37,0,0,0,,,1005,Barbour,31.868263,-85.3871286,0,"Barbour, Alabama, US"
03-28-2020,Alabama,US,2020-03-28 23:05:37,0,0,0,,,1007,Bibb,32.99642064,-87.1251146,0,"Bibb, Alabama, US"
03-28-2020,Alabama,US,2020-03-28 23:05:37,5,0,0,,,1009,Blount,33.98210918,-86.56790593,0,"Blount, Alabama, US"
03-28-2020,Alabama,US,2020-03-28 23:05:37,3,0,0,,,1011,Bullock,32.10030533,-85.71265535,0,"Bullock, Alabama, US"
03-28-2020,Alabama,US,2020-03-28 23:05:37,1,0,0,,,1013,Butler,31.75300095,-86.68057478,0,"Butler, Alabama, US"
03-28-2020,Alabama,US,2020-03-28 23:05:37,3,0,0,,,1015,Calhoun,33.77483727,-85.82630386,0,"Calhoun, Alabama, US"
03-28-2020,Alabama,US,2020-03-28 23:05:37,17,0,0,,,1017,Chambers,32.91360079,-85.39072749,0,"Chambers, Alabama, US"
03-28-2020,Alabama,US,2020-03-28 23:05:37,1,0,0,,,1019,Cherokee,34.17805983,-85.60638968,0,"Cherokee, Alabama, US"
03-28-2020,Alabama,US,2020-03-28 23:05:37,7,0,0,,,1021,Chilton,32.85044126,-86.7173256,0,"Chilton, Alabama, US"
03-28-2020,Alabama,US,2020-03-28 23:05:37,1,0,0,,,1023,Choctaw,32.02227341,-88.2656443,0,"Choctaw, Alabama, US"
03-28-2020,Alabama,US,2020-03-28 23:05:37,0,0,0,,,1025,Clarke,31.68099859,-87.83548597,0,"Clarke, Alabama, US"
03-28-2020,Alabama,US,2020-03-28 23:05:37,2,0,0,,,1027,Clay,33.26984193,-85.85836077,0,"Clay, Alabama, US"
03-28-2020,Alabama,US,2020-03-28 23:05:37,4,0,0,,,1029,Cleburne,33.67679204,-85.52005899,0,"Cleburne, Alabama, US"
03-28-2020,Alabama,US,2020-03-28 23:05:37,0,0,0,,,1031,Coffee,31.39932826,-85.98901039,0,"Coffee, Alabama, US"
03-28-2020,Alabama,US,2020-03-28 23:05:37,1,0,0,,,1033,Colbert,34.69847452,-87.80168544,0,"Colbert, Alabama, US"
03-28-2020,Alabama,US,2020-03-28 23:05:37,0,0,0,,,1035,Conecuh,31.43401703,-86.99320044,0,"Conecuh, Alabama, US"
03-28-2020,Alabama,US,2020-03-28 23:05:37,2,0,0,,,1037,Coosa,32.93690146,-86.24847739,0,"Coosa, Alabama, US"
03-28-2020,Alabama,US,2020-03-28 23:05:37,2,0,0,,,1039,Covington,31.2477854,-86.45050893,0,"Covington, Alabama, US"
03-28-2020,Alabama,US,2020-03-28 23:05:37,1,0,0,,,1041,Crenshaw,31.72941803,-86.31593104,0,"Crenshaw, Alabama, US"
03-28-2020,Alabama,US,2020-03-28 23:05:37,7,0,0,,,1043,Cullman,34.13020303,-86.86888037,0,"Cullman, Alabama, US"
03-28-2020,Alabama,US,2020-03-28 23:05:37,0,0,0,,,1045,Dale,31.43037123,-85.61095742,0,"Dale, Alabama, US"
03-28-2020,Alabama,US,2020-03-28 23:05:37,2,0,0,,,1047,Dallas,32.32688101,-87.1086671,0,"Dallas, Alabama, US"
03-28-2020,Alabama,US,2020-03-28 23:05:37,4,0,0,,,1049,DeKalb,34.45946862,-85.80782906,0,"DeKalb, Alabama, US"
03-28-2020,Alabama,US,2020-03-28 23:05:37,12,0,0,,,1051,Elmore,32.59785413,-86.14415284,0,"Elmore, Alabama, US"
03-28-2020,Alabama,US,2020-03-28 23:05:37,1,0,0,,,1053,Escambia,31.1256789,-87.15918694,0,"Escambia, Alabama, US"
03-28-2020,Alabama,US,2020-03-28 23:05:37,6,0,0,,,1055,Etowah,34.04567266,-86.04051873,0,"Etowah, Alabama, US"
03-28-2020,Alabama,US,2020-03-28 23:05:37,0,0,0,,,1057,Fayette,33.72076938,-87.73886638,0,"Fayette, Alabama, US"
03-28-2020,Alabama,US,2020-03-28 23:05:37,3,0,0,,,1059,Franklin,34.44235334,-87.84289505,0,"Franklin, Alabama, US"
03-28-2020,Alabama,US,2020-03-28 23:05:37,0,0,0,,,1061,Geneva,31.09389027,-85.83572839,0,"Geneva, Alabama, US"
03-28-2020,Alabama,US,2020-03-28 23:05:37,3,0,0,,,1063,Greene,32.85504247,-87.95684022,0,"Greene, Alabama, US"
03-28-2020,Alabama,US,2020-03-28 23:05:37,0,0,0,,,1065,Hale,32.76039258,-87.63284988,0,"Hale, Alabama, US"
03-28-2020,Alabama,US,2020-03-28 23:05:37,0,0,0,,,1067,Henry,31.51148016,-85.24267944,0,"Henry, Alabama, US"
03-28-2020,Alabama,US,2020-03-28 23:05:37,4,0,0,,,1069,Houston,31.15197924,-85.29939599,0,"Houston, Alabama, US"
03-28-2020,Alabama,US,2020-03-28 23:05:37,5,1,0,,,1071,Jackson,34.78144169,-85.99750489,0,"Jackson, Alabama, US"
03-28-2020,Alabama,US,2020-03-28 23:05:37,195,0,0,,,1073,Jefferson,33.55554728,-86.895063,0,"Jefferson, Alabama, US"
03-28-2020,Alabama,US,2020-03-28 23:05:37,1,0,0,,,1075,Lamar,33.77995024,-88.09668032,0,"Lamar, Alabama, US"
03-28-2020,Alabama,US,2020-03-28 23:05:37,12,1,0,,,1077,Lauderdale,34.90171875,-87.65624729,0,"Lauderdale, Alabama, US"
03-28-2020,Alabama,US,2020-03-28 23:05:37,3,0,0,,,1079,Lawrence,34.52041498,-87.31069453,0,"Lawrence, Alabama, US"
03-28-2020,Alabama,US,2020-03-28 23:05:37,56,0,0,,,1081,Lee,32.60154883,-85.35132246,0,"Lee, Alabama, US"
03-28-2020,Alabama,US,2020-03-28 23:05:37,16,0,0,,,1083,Limestone,34.81185586,-86.98310072,0,"Limestone, Alabama, US"
03-28-2020,Alabama,US,2020-03-28 23:05:37,1,0,0,,,1085,Lowndes,32.1597283,-86.65158371,0,"Lowndes, Alabama, US"
03-28-2020,Alabama,US,2020-03-28 23:05:37,0,0,0,,,1087,Macon,32.38759944,-85.69267724,0,"Macon, Alabama, US"
03-28-2020,Alabama,US,2020-03-28 23:05:37,62,1,0,,,1089,Madison,34.76327133,-86.55069633,0,"Madison, Alabama, US"
03-28-2020,Alabama,US,2020-03-28 23:05:37,3,0,0,,,1091,Marengo,32.24767634,-87.78796182,0,"Marengo, Alabama, US"
03-28-2020,Alabama,US,2020-03-28 23:05:37,9,0,0,,,1093,Marion,34.13697363,-87.88704173,0,"Marion, Alabama, US"
03-28-2020,Alabama,US,2020-03-28 23:05:37,4,0,0,,,1095,Marshall,34.36975964,-86.30486727,0,"Marshall, Alabama, US"
03-28-2020,Alabama,US,2020-03-28 23:05:37,29,1,0,,,1097,Mobile,30.78472347,-88.20842409,0,"Mobile, Alabama, US"
03-28-2020,Alabama,US,2020-03-28 23:05:37,1,0,0,,,1099,Monroe,31.56729412,-87.36995001,0,"Monroe, Alabama, US"
03-28-2020,Alabama,US,2020-03-28 23:05:37,18,0,0,,,1101,Montgomery,32.2206831,-86.20969272,0,"Montgomery, Alabama, US"
03-28-2020,Alabama,US,2020-03-28 23:05:37,15,0,0,,,1103,Morgan,34.45500589,-86.85475946,0,"Morgan, Alabama, US"
03-28-2020,Alabama,US,2020-03-28 23:05:37,0,0,0,,,1105,Perry,32.64048341,-87.29770589,0,"Perry, Alabama, US"
03-28-2020,Alabama,US,2020-03-28 23:05:37,1,0,0,,,1107,Pickens,33.28094866,-88.08818103,0,"Pickens, Alabama, US"
03-28-2020,Alabama,US,2020-03-28 23:05:37,4,0,0,,,1109,Pike,31.80396383,-85.9408295,0,"Pike, Alabama, US"
03-28-2020,Alabama,US,2020-03-28 23:05:37,2,0,0,,,1111,Randolph,33.29526734,-85.45708831,0,"Randolph, Alabama, US"
03-28-2020,Alabama,US,2020-03-28 23:05:37,1,0,0,,,1113,Russell,32.28725256,-85.18415324,0,"Russell, Alabama, US"
03-28-2020,Alabama,US,2020-03-28 23:05:37,72,0,0,,,1117,Shelby,33.26879845,-86.66232561,0,"Shelby, Alabama, US"
03-28-2020,Alabama,US,2020-03-28 23:05:37,11,0,0,,,1115,St. Clair,33.71902176,-86.31029372,0,"St. Clair, Alabama, US"
03-28-2020,Alabama,US,2020-03-28 23:05:37,0,0,0,,,1119,Sumter,32.59117397,-88.19916205,0,"Sumter, Alabama, US"
03-28-2020,Alabama,US,2020-03-28 23:05:37,4,0,0,,,1121,Talladega,33.37823223,-86.16886178,0,"Talladega, Alabama, US"
03-28-2020,Alabama,US,2020-03-28 23:05:37,5,0,0,,,1123,Tallapoosa,32.86698258,-85.79833053,0,"Tallapoosa, Alabama, US"
03-28-2020,Alabama,US,2020-03-28 23:05:37,22,0,0,,,1125,Tuscaloosa,33.28726072,-87.52556818,0,"Tuscaloosa, Alabama, US"
03-28-2020,Alabama,US,2020-03-28 23:05:37,28,0,0,,,1127,Walker,33.80270512,-87.30027177,0,"Walker, Alabama, US"
03-28-2020,Alabama,US,2020-03-28 23:05:37,2,0,0,,,1129,Washington,31.4092794,-88.20689944,0,"Washington, Alabama, US"
03-28-2020,Alabama,US,2020-03-28 23:05:37,2,0,0,,,1131,Wilcox,31.98773215,-87.30891118,0,"Wilcox, Alabama, US"
03-28-2020,Alabama,US,2020-03-28 23:05:37,2,0,0,,,1133,Winston,34.15030532,-87.37325922,0,"Winston, Alabama, US"
03-29-2020,Alabama,US,2020-03-29 23:08:25,6,0,0,,,1001,Autauga,32.53952745,-86.64408227,0,"Autauga, Alabama, US"
03-29-2020,Alabama,US,2020-03-29 23:08:25,15,1,0,,,1003,Baldwin,30.72774991,-87.72207058,0,"Baldwin, Alabama, US"
03-29-2020,Alabama,US,2020-03-29 23:08:25,0,0,0,,,1005,Barbour,31.868263,-85.3871286,0,"Barbour, Alabama, US"
03-29-2020,Alabama,US,2020-03-29 23:08:25,0,0,0,,,1007,Bibb,32.99642064,-87.1251146,0,"Bibb, Alabama, US"
03-29-2020,Alabama,US,2020-03-29 23:08:25,5,0,0,,,1009,Blount,33.98210918,-86.56790593,0,"Blount, Alabama, US"
03-29-2020,Alabama,US,2020-03-29 23:08:25,3,0,0,,,1011,Bullock,32.10030533,-85.71265535,0,"Bullock, Alabama, US"
03-29-2020,Alabama,US,2020-03-29 23:08:25,1,0,0,,,1013,Butler,31.75300095,-86.68057478,0,"Butler, Alabama, US"
03-29-2020,Alabama,US,2020-03-29 23:08:25,3,0,0,,,1015,Calhoun,33.77483727,-85.82630386,0,"Calhoun, Alabama, US"
03-29-2020,Alabama,US,2020-03-29 23:08:25,27,3,0,,,1017,Chambers,32.91360079,-85.39072749,0,"Chambers, Alabama, US"
03-29-2020,Alabama,US,2020-03-29 23:08:25,2,0,0,,,1019,Cherokee,34.17805983,-85.60638968,0,"Cherokee, Alabama, US"
03-29-2020,Alabama,US,2020-03-29 23:08:25,7,0,0,,,1021,Chilton,32.85044126,-86.7173256,0,"Chilton, Alabama, US"
03-29-2020,Alabama,US,2020-03-29 23:08:25,1,0,0,,,1023,Choctaw,32.02227341,-88.2656443,0,"Choctaw, Alabama, US"
03-29-2020,Alabama,US,2020-03-29 23:08:25,0,0,0,,,1025,Clarke,31.68099859,-87.83548597,0,"Clarke, Alabama, US"
03-29-2020,Alabama,US,2020-03-29 23:08:25,2,0,0,,,1027,Clay,33.26984193,-85.85836077,0,"Clay, Alabama, US"
03-29-2020,Alabama,US,2020-03-29 23:08:25,5,0,0,,,1029,Cleburne,33.67679204,-85.52005899,0,"Cleburne, Alabama, US"
03-29-2020,Alabama,US,2020-03-29 23:08:25,0,0,0,,,1031,Coffee,31.39932826,-85.98901039,0,"Coffee, Alabama, US"
03-29-2020,Alabama,US,2020-03-29 23:08:25,2,0,0,,,1033,Colbert,34.69847452,-87.80168544,0,"Colbert, Alabama, US"
03-29-2020,Alabama,US,2020-03-29 23:08:25,0,0,0,,,1035,Conecuh,31.43401703,-86.99320044,0,"Conecuh, Alabama, US"
03-29-2020,Alabama,US,2020-03-29 23:08:25,3,0,0,,,1037,Coosa,32.93690146,-86.24847739,0,"Coosa, Alabama, US"
03-29-2020,Alabama,US,2020-03-29 23:08:25,2,0,0,,,1039,Covington,31.2477854,-86.45050893,0,"Covington, Alabama, US"
03-29-2020,Alabama,US,2020-03-29 23:08:25,1,0,0,,,1041,Crenshaw,31.72941803,-86.31593104,0,"Crenshaw, Alabama, US"
03-29-2020,Alabama,US,2020-03-29 23:08:25,7,0,0,,,1043,Cullman,34.13020303,-86.86888037,0,"Cullman, Alabama, US"
03-29-2020,Alabama,US,2020-03-29 23:08:25,0,0,0,,,1045,Dale,31.43037123,-85.61095742,0,"Dale, Alabama, US"
03-29-2020,Alabama,US,2020-03-29 23:08:25,2,0,0,,,1047,Dallas,32.32688101,-87.1086671,0,"Dallas, Alabama, US"
03-29-2020,Alabama,US,2020-03-29 23:08:25,4,0,0,,,1049,DeKalb,34.45946862,-85.80782906,0,"DeKalb, Alabama, US"
03-29-2020,Alabama,US,2020-03-29 23:08:25,13,0,0,,,1051,Elmore,32.59785413,-86.14415284,0,"Elmore, Alabama, US"
03-29-2020,Alabama,US,2020-03-29 23:08:25,1,0,0,,,1053,Escambia,31.1256789,-87.15918694,0,"Escambia, Alabama, US"
03-29-2020,Alabama,US,2020-03-29 23:08:25,6,0,0,,,1055,Etowah,34.04567266,-86.04051873,0,"Etowah, Alabama, US"
03-29-2020,Alabama,US,2020-03-29 23:08:25,0,0,0,,,1057,Fayette,33.72076938,-87.73886638,0,"Fayette, Alabama, US"
03-29-2020,Alabama,US,2020-03-29 23:08:25,3,0,0,,,1059,Franklin,34.44235334,-87.84289505,0,"Franklin, Alabama, US"
03-29-2020,Alabama,US,2020-03-29 23:08:25,0,0,0,,,1061,Geneva,31.09389027,-85.83572839,0,"Geneva, Alabama, US"
03-29-2020,Alabama,US,2020-03-29 23:08:25,3,0,0,,,1063,Greene,32.85504247,-87.95684022,0,"Greene, Alabama, US"
03-29-2020,Alabama,US,2020-03-29 23:08:25,0,0,0,,,1065,Hale,32.76039258,-87.63284988,0,"Hale, Alabama, US"
03-29-2020,Alabama,US,2020-03-29 23:08:25,0,0,0,,,1067,Henry,31.51148016,-85.24267944,0,"Henry, Alabama, US"
03-29-2020,Alabama,US,2020-03-29 23:08:25,6,0,0,,,1069,Houston,31.15197924,-85.29939599,0,"Houston, Alabama, US"
03-29-2020,Alabama,US,2020-03-29 23:08:25,5,1,0,,,1071,Jackson,34.78144169,-85.99750489,0,"Jackson, Alabama, US"
03-29-2020,Alabama,US,2020-03-29 23:08:25,245,0,0,,,1073,Jefferson,33.55554728,-86.895063,0,"Jefferson, Alabama, US"
03-29-2020,Alabama,US,2020-03-29 23:08:25,1,0,0,,,1075,Lamar,33.77995024,-88.09668032,0,"Lamar, Alabama, US"
03-29-2020,Alabama,US,2020-03-29 23:08:25,12,1,0,,,1077,Lauderdale,34.90171875,-87.65624729,0,"Lauderdale, Alabama, US"
03-29-2020,Alabama,US,2020-03-29 23:08:25,3,0,0,,,1079,Lawrence,34.52041498,-87.31069453,0,"Lawrence, Alabama, US"
03-29-2020,Alabama,US,2020-03-29 23:08:25,59,2,0,,,1081,Lee,32.60154883,-85.35132246,0,"Lee, Alabama, US"
03-29-2020,Alabama,US,2020-03-29 23:08:25,16,0,0,,,1083,Limestone,34.81185586,-86.98310072,0,"Limestone, Alabama, US"
03-29-2020,Alabama,US,2020-03-29 23:08:25,1,0,0,,,1085,Lowndes,32.1597283,-86.65158371,0,"Lowndes, Alabama, US"
03-29-2020,Alabama,US,2020-03-29 23:08:25,1,0,0,,,1087,Macon,32.38759944,-85.69267724,0,"Macon, Alabama, US"
03-29-2020,Alabama,US,2020-03-29 23:08:25,79,1,0,,,1089,Madison,34.76327133,-86.55069633,0,"Madison, Alabama, US"
03-29-2020,Alabama,US,2020-03-29 23:08:25,5,0,0,,,1091,Marengo,32.24767634,-87.78796182,0,"Marengo, Alabama, US"
03-29-2020,Alabama,US,2020-03-29 23:08:25,10,0,0,,,1093,Marion,34.13697363,-87.88704173,0,"Marion, Alabama, US"
03-29-2020,Alabama,US,2020-03-29 23:08:25,5,0,0,,,1095,Marshall,34.36975964,-86.30486727,0,"Marshall, Alabama, US"
03-29-2020,Alabama,US,2020-03-29 23:08:25,40,1,0,,,1097,Mobile,30.78472347,-88.20842409,0,"Mobile, Alabama, US"
03-29-2020,Alabama,US,2020-03-29 23:08:25,1,0,0,,,1099,Monroe,31.56729412,-87.36995001,0,"Monroe, Alabama, US"
03-29-2020,Alabama,US,2020-03-29 23:08:25,21,0,0,,,1101,Montgomery,32.2206831,-86.20969272,0,"Montgomery, Alabama, US"
03-29-2020,Alabama,US,2020-03-29 23:08:25,17,0,0,,,1103,Morgan,34.45500589,-86.85475946,0,"Morgan, Alabama, US"
03-29-2020,Alabama,US,2020-03-29 23:08:25,0,0,0,,,1105,Perry,32.64048341,-87.29770589,0,"Perry, Alabama, US"
03-29-2020,Alabama,US,2020-03-29 23:08:25,2,0,0,,,1107,Pickens,33.28094866,-88.08818103,0,"Pickens, Alabama, US"
03-29-2020,Alabama,US,2020-03-29 23:08:25,4,0,0,,,1109,Pike,31.80396383,-85.9408295,0,"Pike, Alabama, US"
03-29-2020,Alabama,US,2020-03-29 23:08:25,2,0,0,,,1111,Randolph,33.29526734,-85.45708831,0,"Randolph, Alabama, US"
03-29-2020,Alabama,US,2020-03-29 23:08:25,1,0,0,,,1113,Russell,32.28725256,-85.18415324,0,"Russell, Alabama, US"
03-29-2020,Alabama,US,2020-03-29 23:08:25,79,0,0,,,1117,Shelby,33.26879845,-86.66232561,0,"Shelby, Alabama, US"
03-29-2020,Alabama,US,2020-03-29 23:08:25,13,0,0,,,1115,St. Clair,33.71902176,-86.31029372,0,"St. Clair, Alabama, US"
03-29-2020,Alabama,US,2020-03-29 23:08:25,0,0,0,,,1119,Sumter,32.59117397,-88.19916205,0,"Sumter, Alabama, US"
03-29-2020,Alabama,US,2020-03-29 23:08:25,4,0,0,,,1121,Talladega,33.37823223,-86.16886178,0,"Talladega, Alabama, US"
03-29-2020,Alabama,US,2020-03-29 23:08:25,8,0,0,,,1123,Tallapoosa,32.86698258,-85.79833053,0,"Tallapoosa, Alabama, US"
03-29-2020,Alabama,US,2020-03-29 23:08:25,23,0,0,,,1125,Tuscaloosa,33.28726072,-87.52556818,0,"Tuscaloosa, Alabama, US"
03-29-2020,Alabama,US,2020-03-29 23:08:25,30,0,0,,,1127,Walker,33.80270512,-87.30027177,0,"Walker, Alabama, US"
03-29-2020,Alabama,US,2020-03-29 23:08:25,4,0,0,,,1129,Washington,31.4092794,-88.20689944,0,"Washington, Alabama, US"
03-29-2020,Alabama,US,2020-03-29 23:08:25,2,0,0,,,1131,Wilcox,31.98773215,-87.30891118,0,"Wilcox, Alabama, US"
03-29-2020,Alabama,US,2020-03-29 23:08:25,2,0,0,,,1133,Winston,34.15030532,-87.37325922,0,"Winston, Alabama, US"
03-30-2020,Alabama,US,2020-03-30 22:52:45,6,0,0,,,1001,Autauga,32.53952745,-86.64408227,0,"Autauga, Alabama, US"
03-30-2020,Alabama,US,2020-03-30 22:52:45,18,1,0,,,1003,Baldwin,30.72774991,-87.72207058,0,"Baldwin, Alabama, US"
03-30-2020,Alabama,US,2020-03-30 22:52:45,0,0,0,,,1005,Barbour,31.868263,-85.3871286,0,"Barbour, Alabama, US"
03-30-2020,Alabama,US,2020-03-30 22:52:45,2,0,0,,,1007,Bibb,32.99642064,-87.1251146,0,"Bibb, Alabama, US"
03-30-2020,Alabama,US,2020-03-30 22:52:45,5,0,0,,,1009,Blount,33.98210918,-86.56790593,0,"Blount, Alabama, US"
03-30-2020,Alabama,US,2020-03-30 22:52:45,3,0,0,,,1011,Bullock,32.10030533,-85.71265535,0,"Bullock, Alabama, US"
03-30-2020,Alabama,US,2020-03-30 22:52:45,1,0,0,,,1013,Butler,31.75300095,-86.68057478,0,"Butler, Alabama, US"
03-30-2020,Alabama,US,2020-03-30 22:52:45,8,0,0,,,1015,Calhoun,33.77483727,-85.82630386,0,"Calhoun, Alabama, US"
03-30-2020,Alabama,US,2020-03-30 22:52:45,33,3,0,,,1017,Chambers,32.91360079,-85.39072749,0,"Chambers, Alabama, US"
03-30-2020,Alabama,US,2020-03-30 22:52:45,2,0,0,,,1019,Cherokee,34.17805983,-85.60638968,0,"Cherokee, Alabama, US"
03-30-2020,Alabama,US,2020-03-30 22:52:45,10,0,0,,,1021,Chilton,32.85044126,-86.7173256,0,"Chilton, Alabama, US"
03-30-2020,Alabama,US,2020-03-30 22:52:45,2,0,0,,,1023,Choctaw,32.02227341,-88.2656443,0,"Choctaw, Alabama, US"
03-30-2020,Alabama,US,2020-03-30 22:52:45,0,0,0,,,1025,Clarke,31.68099859,-87.83548597,0,"Clarke, Alabama, US"
03-30-2020,Alabama,US,2020-03-30 22:52:45,2,0,0,,,1027,Clay,33.26984193,-85.85836077,0,"Clay, Alabama, US"
03-30-2020,Alabama,US,2020-03-30 22:52:45,5,0,0,,,1029,Cleburne,33.67679204,-85.52005899,0,"Cleburne, Alabama, US"
03-30-2020,Alabama,US,2020-03-30 22:52:45,0,0,0,,,1031,Coffee,31.39932826,-85.98901039,0,"Coffee, Alabama, US"
03-30-2020,Alabama,US,2020-03-30 22:52:45,4,0,0,,,1033,Colbert,34.69847452,-87.80168544,0,"Colbert, Alabama, US"
03-30-2020,Alabama,US,2020-03-30 22:52:45,0,0,0,,,1035,Conecuh,31.43401703,-86.99320044,0,"Conecuh, Alabama, US"
03-30-2020,Alabama,US,2020-03-30 22:52:45,3,0,0,,,1037,Coosa,32.93690146,-86.24847739,0,"Coosa, Alabama, US"
03-30-2020,Alabama,US,2020-03-30 22:52:45,2,0,0,,,1039,Covington,31.2477854,-86.45050893,0,"Covington, Alabama, US"
03-30-2020,Alabama,US,2020-03-30 22:52:45,1,0,0,,,1041,Crenshaw,31.72941803,-86.31593104,0,"Crenshaw, Alabama, US"
03-30-2020,Alabama,US,2020-03-30 22:52:45,8,0,0,,,1043,Cullman,34.13020303,-86.86888037,0,"Cullman, Alabama, US"
03-30-2020,Alabama,US,2020-03-30 22:52:45,0,0,0,,,1045,Dale,31.43037123,-85.61095742,0,"Dale, Alabama, US"
03-30-2020,Alabama,US,2020-03-30 22:52:45,2,0,0,,,1047,Dallas,32.32688101,-87.1086671,0,"Dallas, Alabama, US"
03-30-2020,Alabama,US,2020-03-30 22:52:45,4,0,0,,,1049,DeKalb,34.45946862,-85.80782906,0,"DeKalb, Alabama, US"
03-30-2020,Alabama,US,2020-03-30 22:52:45,13,0,0,,,1051,Elmore,32.59785413,-86.14415284,0,"Elmore, Alabama, US"
03-30-2020,Alabama,US,2020-03-30 22:52:45,1,0,0,,,1053,Escambia,31.1256789,-87.15918694,0,"Escambia, Alabama, US"
03-30-2020,Alabama,US,2020-03-30 22:52:45,6,0,0,,,1055,Etowah,34.04567266,-86.04051873,0,"Etowah, Alabama, US"
03-30-2020,Alabama,US,2020-03-30 22:52:45,1,0,0,,,1057,Fayette,33.72076938,-87.73886638,0,"Fayette, Alabama, US"
03-30-2020,Alabama,US,2020-03-30 22:52:45,3,0,0,,,1059,Franklin,34.44235334,-87.84289505,0,"Franklin, Alabama, US"
03-30-2020,Alabama,US,2020-03-30 22:52:45,0,0,0,,,1061,Geneva,31.09389027,-85.83572839,0,"Geneva, Alabama, US"
03-30-2020,Alabama,US,2020-03-30 22:52:45,3,0,0,,,1063,Greene,32.85504247,-87.95684022,0,"Greene, Alabama, US"
03-30-2020,Alabama,US,2020-03-30 22:52:45,1,0,0,,,1065,Hale,32.76039258,-87.63284988,0,"Hale, Alabama, US"
03-30-2020,Alabama,US,2020-03-30 22:52:45,0,0,0,,,1067,Henry,31.51148016,-85.24267944,0,"Henry, Alabama, US"
03-30-2020,Alabama,US,2020-03-30 22:52:45,9,0,0,,,1069,Houston,31.15197924,-85.29939599,0,"Houston, Alabama, US"
03-30-2020,Alabama,US,2020-03-30 22:52:45,5,1,0,,,1071,Jackson,34.78144169,-85.99750489,0,"Jackson, Alabama, US"
03-30-2020,Alabama,US,2020-03-30 22:52:45,254,0,0,,,1073,Jefferson,33.55554728,-86.895063,0,"Jefferson, Alabama, US"
03-30-2020,Alabama,US,2020-03-30 22:52:45,1,0,0,,,1075,Lamar,33.77995024,-88.09668032,0,"Lamar, Alabama, US"
03-30-2020,Alabama,US,2020-03-30 22:52:45,12,1,0,,,1077,Lauderdale,34.90171875,-87.65624729,0,"Lauderdale, Alabama, US"
03-30-2020,Alabama,US,2020-03-30 22:52:45,3,0,0,,,1079,Lawrence,34.52041498,-87.31069453,0,"Lawrence, Alabama, US"
03-30-2020,Alabama,US,2020-03-30 22:52:45,71,2,0,,,1081,Lee,32.60154883,-85.35132246,0,"Lee, Alabama, US"
03-30-2020,Alabama,US,2020-03-30 22:52:45,20,0,0,,,1083,Limestone,34.81185586,-86.98310072,0,"Limestone, Alabama, US"
03-30-2020,Alabama,US,2020-03-30 22:52:45,1,0,0,,,1085,Lowndes,32.1597283,-86.65158371,0,"Lowndes, Alabama, US"
03-30-2020,Alabama,US,2020-03-30 22:52:45,1,0,0,,,1087,Macon,32.38759944,-85.69267724,0,"Macon, Alabama, US"
03-30-2020,Alabama,US,2020-03-30 22:52:45,91,1,0,,,1089,Madison,34.76327133,-86.55069633,0,"Madison, Alabama, US"
03-30-2020,Alabama,US,2020-03-30 22:52:45,5,0,0,,,1091,Marengo,32.24767634,-87.78796182,0,"Marengo, Alabama, US"
03-30-2020,Alabama,US,2020-03-30 22:52:45,10,0,0,,,1093,Marion,34.13697363,-87.88704173,0,"Marion, Alabama, US"
03-30-2020,Alabama,US,2020-03-30 22:52:45,7,0,0,,,1095,Marshall,34.36975964,-86.30486727,0,"Marshall, Alabama, US"
03-30-2020,Alabama,US,2020-03-30 22:52:45,44,1,0,,,1097,Mobile,30.78472347,-88.20842409,0,"Mobile, Alabama, US"
03-30-2020,Alabama,US,2020-03-30 22:52:45,1,0,0,,,1099,Monroe,31.56729412,-87.36995001,0,"Monroe, Alabama, US"
03-30-2020,Alabama,US,2020-03-30 22:52:45,22,0,0,,,1101,Montgomery,32.2206831,-86.20969272,0,"Montgomery, Alabama, US"
03-30-2020,Alabama,US,2020-03-30 22:52:45,17,0,0,,,1103,Morgan,34.45500589,-86.85475946,0,"Morgan, Alabama, US"
03-30-2020,Alabama,US,2020-03-30 22:52:45,0,0,0,,,1105,Perry,32.64048341,-87.29770589,0,"Perry, Alabama, US"
03-30-2020,Alabama,US,2020-03-30 22:52:45,2,0,0,,,1107,Pickens,33.28094866,-88.08818103,0,"Pickens, Alabama, US"
03-30-2020,Alabama,US,2020-03-30 22:52:45,4,0,0,,,1109,Pike,31.80396383,-85.9408295,0,"Pike, Alabama, US"
03-30-2020,Alabama,US,2020-03-30 22:52:45,2,0,0,,,1111,Randolph,33.29526734,-85.45708831,0,"Randolph, Alabama, US"
03-30-2020,Alabama,US,2020-03-30 22:52:45,1,0,0,,,1113,Russell,32.28725256,-85.18415324,0,"Russell, Alabama, US"
03-30-2020,Alabama,US,2020-03-30 22:52:45,79,0,0,,,1117,Shelby,33.26879845,-86.66232561,0,"Shelby, Alabama, US"
03-30-2020,Alabama,US,2020-03-30 22:52:45,13,0,0,,,1115,St. Clair,33.71902176,-86.31029372,0,"St. Clair, Alabama, US"
03-30-2020,Alabama,US,2020-03-30 22:52:45,0,0,0,,,1119,Sumter,32.59117397,-88.19916205,0,"Sumter, Alabama, US"
03-30-2020,Alabama,US,2020-03-30 22:52:45,5,0,0,,,1121,Talladega,33.37823223,-86.16886178,0,"Talladega, Alabama, US"
03-30-2020,Alabama,US,2020-03-30 22:52:45,8,0,0,,,1123,Tallapoosa,32.86698258,-85.79833053,0,"Tallapoosa, Alabama, US"
03-30-2020,Alabama,US,2020-03-30 22:52:45,24,0,0,,,1125,Tuscaloosa,33.28726072,-87.52556818,0,"Tuscaloosa, Alabama, US"
03-30-2020,Alabama,US,2020-03-30 22:52:45,30,0,0,,,1127,Walker,33.80270512,-87.30027177,0,"Walker, Alabama, US"
03-30-2020,Alabama,US,2020-03-30 22:52:45,4,0,0,,,1129,Washington,31.4092794,-88.20689944,0,"Washington, Alabama, US"
03-30-2020,Alabama,US,2020-03-30 22:52:45,2,0,0,,,1131,Wilcox,31.98773215,-87.30891118,0,"Wilcox, Alabama, US"
03-30-2020,Alabama,US,2020-03-30 22:52:45,2,0,0,,,1133,Winston,34.15030532,-87.37325922,0,"Winston, Alabama, US"
03-31-2020,Alabama,US,2020-03-31 23:43:56,7,0,0,,,1001,Autauga,32.53952745,-86.64408227,0,"Autauga, Alabama, US"
03-31-2020,Alabama,US,2020-03-31 23:43:56,19,1,0,,,1003,Baldwin,30.72774991,-87.72207058,0,"Baldwin, Alabama, US"
03-31-2020,Alabama,US,2020-03-31 23:43:56,3,0,0,,,1007,Bibb,32.99642064,-87.1251146,0,"Bibb, Alabama, US"
03-31-2020,Alabama,US,2020-03-31 23:43:56,5,0,0,,,1009,Blount,33.98210918,-86.56790593,0,"Blount, Alabama, US"
03-31-2020,Alabama,US,2020-03-31 23:43:56,3,0,0,,,1011,Bullock,32.10030533,-85.71265535,0,"Bullock, Alabama, US"
03-31-2020,Alabama,US,2020-03-31 23:43:56,1,0,0,,,1013,Butler,31.75300095,-86.68057478,0,"Butler, Alabama, US"
03-31-2020,Alabama,US,2020-03-31 23:43:56,9,0,0,,,1015,Calhoun,33.77483727,-85.82630386,0,"Calhoun, Alabama, US"
03-31-2020,Alabama,US,2020-03-31 23:43:56,36,4,0,,,1017,Chambers,32.91360079,-85.39072749,0,"Chambers, Alabama, US"
03-31-2020,Alabama,US,2020-03-31 23:43:56,2,0,0,,,1019,Cherokee,34.17805983,-85.60638968,0,"Cherokee, Alabama, US"
03-31-2020,Alabama,US,2020-03-31 23:43:56,11,0,0,,,1021,Chilton,32.85044126,-86.7173256,0,"Chilton, Alabama, US"
03-31-2020,Alabama,US,2020-03-31 23:43:56,3,0,0,,,1023,Choctaw,32.02227341,-88.2656443,0,"Choctaw, Alabama, US"
03-31-2020,Alabama,US,2020-03-31 23:43:56,2,0,0,,,1027,Clay,33.26984193,-85.85836077,0,"Clay, Alabama, US"
03-31-2020,Alabama,US,2020-03-31 23:43:56,5,0,0,,,1029,Cleburne,33.67679204,-85.52005899,0,"Cleburne, Alabama, US"
03-31-2020,Alabama,US,2020-03-31 23:43:56,4,0,0,,,1033,Colbert,34.69847452,-87.80168544,0,"Colbert, Alabama, US"
03-31-2020,Alabama,US,2020-03-31 23:43:56,4,0,0,,,1037,Coosa,32.93690146,-86.24847739,0,"Coosa, Alabama, US"
03-31-2020,Alabama,US,2020-03-31 23:43:56,2,0,0,,,1039,Covington,31.2477854,-86.45050893,0,"Covington, Alabama, US"
03-31-2020,Alabama,US,2020-03-31 23:43:56,1,0,0,,,1041,Crenshaw,31.72941803,-86.31593104,0,"Crenshaw, Alabama, US"
03-31-2020,Alabama,US,2020-03-31 23:43:56,8,0,0,,,1043,Cullman,34.13020303,-86.86888037,0,"Cullman, Alabama, US"
03-31-2020,Alabama,US,2020-03-31 23:43:56,2,0,0,,,1047,Dallas,32.32688101,-87.1086671,0,"Dallas, Alabama, US"
03-31-2020,Alabama,US,2020-03-31 23:43:56,4,0,0,,,1049,DeKalb,34.45946862,-85.80782906,0,"DeKalb, Alabama, US"
03-31-2020,Alabama,US,2020-03-31 23:43:56,13,0,0,,,1051,Elmore,32.59785413,-86.14415284,0,"Elmore, Alabama, US"
03-31-2020,Alabama,US,2020-03-31 23:43:56,1,0,0,,,1053,Escambia,31.1256789,-87.15918694,0,"Escambia, Alabama, US"
03-31-2020,Alabama,US,2020-03-31 23:43:56,8,0,0,,,1055,Etowah,34.04567266,-86.04051873,0,"Etowah, Alabama, US"
03-31-2020,Alabama,US,2020-03-31 23:43:56,1,0,0,,,1057,Fayette,33.72076938,-87.73886638,0,"Fayette, Alabama, US"
03-31-2020,Alabama,US,2020-03-31 23:43:56,3,0,0,,,1059,Franklin,34.44235334,-87.84289505,0,"Franklin, Alabama, US"
03-31-2020,Alabama,US,2020-03-31 23:43:56,3,0,0,,,1063,Greene,32.85504247,-87.95684022,0,"Greene, Alabama, US"
03-31-2020,Alabama,US,2020-03-31 23:43:56,1,0,0,,,1065,Hale,32.76039258,-87.63284988,0,"Hale, Alabama, US"
03-31-2020,Alabama,US,2020-03-31 23:43:56,9,0,0,,,1069,Houston,31.15197924,-85.29939599,0,"Houston, Alabama, US"
03-31-2020,Alabama,US,2020-03-31 23:43:56,8,1,0,,,1071,Jackson,34.78144169,-85.99750489,0,"Jackson, Alabama, US"
03-31-2020,Alabama,US,2020-03-31 23:43:56,270,0,0,,,1073,Jefferson,33.55554728,-86.895063,0,"Jefferson, Alabama, US"
03-31-2020,Alabama,US,2020-03-31 23:43:56,1,0,0,,,1075,Lamar,33.77995024,-88.09668032,0,"Lamar, Alabama, US"
03-31-2020,Alabama,US,2020-03-31 23:43:56,12,1,0,,,1077,Lauderdale,34.90171875,-87.65624729,0,"Lauderdale, Alabama, US"
03-31-2020,Alabama,US,2020-03-31 23:43:56,3,0,0,,,1079,Lawrence,34.52041498,-87.31069453,0,"Lawrence, Alabama, US"
03-31-2020,Alabama,US,2020-03-31 23:43:56,75,2,0,,,1081,Lee,32.60154883,-85.35132246,0,"Lee, Alabama, US"
03-31-2020,Alabama,US,2020-03-31 23:43:56,22,0,0,,,1083,Limestone,34.81185586,-86.98310072,0,"Limestone, Alabama, US"
03-31-2020,Alabama,US,2020-03-31 23:43:56,1,0,0,,,1085,Lowndes,32.1597283,-86.65158371,0,"Lowndes, Alabama, US"
03-31-2020,Alabama,US,2020-03-31 23:43:56,1,0,0,,,1087,Macon,32.38759944,-85.69267724,0,"Macon, Alabama, US"
03-31-2020,Alabama,US,2020-03-31 23:43:56,99,1,0,,,1089,Madison,34.76327133,-86.55069633,0,"Madison, Alabama, US"
03-31-2020,Alabama,US,2020-03-31 23:43:56,4,0,0,,,1091,Marengo,32.24767634,-87.78796182,0,"Marengo, Alabama, US"
03-31-2020,Alabama,US,2020-03-31 23:43:56,9,0,0,,,1093,Marion,34.13697363,-87.88704173,0,"Marion, Alabama, US"
03-31-2020,Alabama,US,2020-03-31 23:43:56,7,0,0,,,1095,Marshall,34.36975964,-86.30486727,0,"Marshall, Alabama, US"
03-31-2020,Alabama,US,2020-03-31 23:43:56,52,1,0,,,1097,Mobile,30.78472347,-88.20842409,0,"Mobile, Alabama, US"
03-31-2020,Alabama,US,2020-03-31 23:43:56,1,0,0,,,1099,Monroe,31.56729412,-87.36995001,0,"Monroe, Alabama, US"
03-31-2020,Alabama,US,2020-03-31 23:43:56,29,1,0,,,1101,Montgomery,32.2206831,-86.20969272,0,"Montgomery, Alabama, US"
03-31-2020,Alabama,US,2020-03-31 23:43:56,20,0,0,,,1103,Morgan,34.45500589,-86.85475946,0,"Morgan, Alabama, US"
03-31-2020,Alabama,US,2020-03-31 23:43:56,4,0,0,,,1107,Pickens,33.28094866,-88.08818103,0,"Pickens, Alabama, US"
03-31-2020,Alabama,US,2020-03-31 23:43:56,4,0,0,,,1109,Pike,31.80396383,-85.9408295,0,"Pike, Alabama, US"
03-31-2020,Alabama,US,2020-03-31 23:43:56,2,0,0,,,1111,Randolph,33.29526734,-85.45708831,0,"Randolph, Alabama, US"
03-31-2020,Alabama,US,2020-03-31 23:43:56,1,0,0,,,1113,Russell,32.28725256,-85.18415324,0,"Russell, Alabama, US"
03-31-2020,Alabama,US,2020-03-31 23:43:56,88,2,0,,,1117,Shelby,33.26879845,-86.66232561,0,"Shelby, Alabama, US"
03-31-2020,Alabama,US,2020-03-31 23:43:56,15,0,0,,,1115,St. Clair,33.71902176,-86.31029372,0,"St. Clair, Alabama, US"
03-31-2020,Alabama,US,2020-03-31 23:43:56,1,0,0,,,1119,Sumter,32.59117397,-88.19916205,0,"Sumter, Alabama, US"
03-31-2020,Alabama,US,2020-03-31 23:43:56,7,0,0,,,1121,Talladega,33.37823223,-86.16886178,0,"Talladega, Alabama, US"
03-31-2020,Alabama,US,2020-03-31 23:43:56,12,1,0,,,1123,Tallapoosa,32.86698258,-85.79833053,0,"Tallapoosa, Alabama, US"
03-31-2020,Alabama,US,2020-03-31 23:43:56,29,0,0,,,1125,Tuscaloosa,33.28726072,-87.52556818,0,"Tuscaloosa, Alabama, US"
03-31-2020,Alabama,US,2020-03-31 23:43:56,0,8,0,,,,Unassigned,0,0,0,"Unassigned, Alabama, US"
03-31-2020,Alabama,US,2020-03-31 23:43:56,32,0,0,,,1127,Walker,33.80270512,-87.30027177,0,"Walker, Alabama, US"
03-31-2020,Alabama,US,2020-03-31 23:43:56,3,0,0,,,1129,Washington,31.4092794,-88.20689944,0,"Washington, Alabama, US"
03-31-2020,Alabama,US,2020-03-31 23:43:56,3,0,0,,,1131,Wilcox,31.98773215,-87.30891118,0,"Wilcox, Alabama, US"
03-31-2020,Alabama,US,2020-03-31 23:43:56,2,0,0,,,1133,Winston,34.15030532,-87.37325922,0,"Winston, Alabama, US"
04-01-2020,Alabama,US,2020-04-01 21:58:49,8,0,0,,,1001,Autauga,32.53952745,-86.64408227,0,"Autauga, Alabama, US"
04-01-2020,Alabama,US,2020-04-01 21:58:49,20,1,0,,,1003,Baldwin,30.72774991,-87.72207058,0,"Baldwin, Alabama, US"
04-01-2020,Alabama,US,2020-04-01 21:58:49,3,0,0,,,1007,Bibb,32.99642064,-87.1251146,0,"Bibb, Alabama, US"
04-01-2020,Alabama,US,2020-04-01 21:58:49,5,0,0,,,1009,Blount,33.98210918,-86.56790593,0,"Blount, Alabama, US"
04-01-2020,Alabama,US,2020-04-01 21:58:49,3,0,0,,,1011,Bullock,32.10030533,-85.71265535,0,"Bullock, Alabama, US"
04-01-2020,Alabama,US,2020-04-01 21:58:49,1,0,0,,,1013,Butler,31.75300095,-86.68057478,0,"Butler, Alabama, US"
04-01-2020,Alabama,US,2020-04-01 21:58:49,11,0,0,,,1015,Calhoun,33.77483727,-85.82630386,0,"Calhoun, Alabama, US"
04-01-2020,Alabama,US,2020-04-01 21:58:49,42,4,0,,,1017,Chambers,32.91360079,-85.39072749,0,"Chambers, Alabama, US"
04-01-2020,Alabama,US,2020-04-01 21:58:49,2,0,0,,,1019,Cherokee,34.17805983,-85.60638968,0,"Cherokee, Alabama, US"
04-01-2020,Alabama,US,2020-04-01 21:58:49,13,0,0,,,1021,Chilton,32.85044126,-86.7173256,0,"Chilton, Alabama, US"
04-01-2020,Alabama,US,2020-04-01 21:58:49,4,0,0,,,1023,Choctaw,32.02227341,-88.2656443,0,"Choctaw, Alabama, US"
04-01-2020,Alabama,US,2020-04-01 21:58:49,2,0,0,,,1027,Clay,33.26984193,-85.85836077,0,"Clay, Alabama, US"
04-01-2020,Alabama,US,2020-04-01 21:58:49,6,0,0,,,1029,Cleburne,33.67679204,-85.52005899,0,"Cleburne, Alabama, US"
04-01-2020,Alabama,US,2020-04-01 21:58:49,4,0,0,,,1033,Colbert,34.69847452,-87.80168544,0,"Colbert, Alabama, US"
04-01-2020,Alabama,US,2020-04-01 21:58:49,4,0,0,,,1037,Coosa,32.93690146,-86.24847739,0,"Coosa, Alabama, US"
04-01-2020,Alabama,US,2020-04-01 21:58:49,3,0,0,,,1039,Covington,31.2477854,-86.45050893,0,"Covington, Alabama, US"
04-01-2020,Alabama,US,2020-04-01 21:58:49,1,0,0,,,1041,Crenshaw,31.72941803,-86.31593104,0,"Crenshaw, Alabama, US"
04-01-2020,Alabama,US,2020-04-01 21:58:49,9,1,0,,,1043,Cullman,34.13020303,-86.86888037,0,"Cullman, Alabama, US"
04-01-2020,Alabama,US,2020-04-01 21:58:49,2,0,0,,,1047,Dallas,32.32688101,-87.1086671,0,"Dallas, Alabama, US"
04-01-2020,Alabama,US,2020-04-01 21:58:49,5,0,0,,,1049,DeKalb,34.45946862,-85.80782906,0,"DeKalb, Alabama, US"
04-01-2020,Alabama,US,2020-04-01 21:58:49,14,0,0,,,1051,Elmore,32.59785413,-86.14415284,0,"Elmore, Alabama, US"
04-01-2020,Alabama,US,2020-04-01 21:58:49,1,0,0,,,1053,Escambia,31.1256789,-87.15918694,0,"Escambia, Alabama, US"
04-01-2020,Alabama,US,2020-04-01 21:58:49,10,1,0,,,1055,Etowah,34.04567266,-86.04051873,0,"Etowah, Alabama, US"
04-01-2020,Alabama,US,2020-04-01 21:58:49,1,0,0,,,1057,Fayette,33.72076938,-87.73886638,0,"Fayette, Alabama, US"
04-01-2020,Alabama,US,2020-04-01 21:58:49,3,0,0,,,1059,Franklin,34.44235334,-87.84289505,0,"Franklin, Alabama, US"
04-01-2020,Alabama,US,2020-04-01 21:58:49,4,0,0,,,1063,Greene,32.85504247,-87.95684022,0,"Greene, Alabama, US"
04-01-2020,Alabama,US,2020-04-01 21:58:49,1,0,0,,,1065,Hale,32.76039258,-87.63284988,0,"Hale, Alabama, US"
04-01-2020,Alabama,US,2020-04-01 21:58:49,8,0,0,,,1069,Houston,31.15197924,-85.29939599,0,"Houston, Alabama, US"
04-01-2020,Alabama,US,2020-04-01 21:58:49,8,1,0,,,1071,Jackson,34.78144169,-85.99750489,0,"Jackson, Alabama, US"
04-01-2020,Alabama,US,2020-04-01 21:58:49,292,4,0,,,1073,Jefferson,33.55554728,-86.895063,0,"Jefferson, Alabama, US"
04-01-2020,Alabama,US,2020-04-01 21:58:49,1,0,0,,,1075,Lamar,33.77995024,-88.09668032,0,"Lamar, Alabama, US"
04-01-2020,Alabama,US,2020-04-01 21:58:49,12,1,0,,,1077,Lauderdale,34.90171875,-87.65624729,0,"Lauderdale, Alabama, US"
04-01-2020,Alabama,US,2020-04-01 21:58:49,3,0,0,,,1079,Lawrence,34.52041498,-87.31069453,0,"Lawrence, Alabama, US"
04-01-2020,Alabama,US,2020-04-01 21:58:49,81,2,0,,,1081,Lee,32.60154883,-85.35132246,0,"Lee, Alabama, US"
04-01-2020,Alabama,US,2020-04-01 21:58:49,23,0,0,,,1083,Limestone,34.81185586,-86.98310072,0,"Limestone, Alabama, US"
04-01-2020,Alabama,US,2020-04-01 21:58:49,1,0,0,,,1085,Lowndes,32.1597283,-86.65158371,0,"Lowndes, Alabama, US"
04-01-2020,Alabama,US,2020-04-01 21:58:49,1,0,0,,,1087,Macon,32.38759944,-85.69267724,0,"Macon, Alabama, US"
04-01-2020,Alabama,US,2020-04-01 21:58:49,105,1,0,,,1089,Madison,34.76327133,-86.55069633,0,"Madison, Alabama, US"
04-01-2020,Alabama,US,2020-04-01 21:58:49,4,0,0,,,1091,Marengo,32.24767634,-87.78796182,0,"Marengo, Alabama, US"
04-01-2020,Alabama,US,2020-04-01 21:58:49,9,2,0,,,1093,Marion,34.13697363,-87.88704173,0,"Marion, Alabama, US"
04-01-2020,Alabama,US,2020-04-01 21:58:49,6,0,0,,,1095,Marshall,34.36975964,-86.30486727,0,"Marshall, Alabama, US"
04-01-2020,Alabama,US,2020-04-01 21:58:49,56,3,0,,,1097,Mobile,30.78472347,-88.20842409,0,"Mobile, Alabama, US"
04-01-2020,Alabama,US,2020-04-01 21:58:49,1,0,0,,,1099,Monroe,31.56729412,-87.36995001,0,"Monroe, Alabama, US"
04-01-2020,Alabama,US,2020-04-01 21:58:49,35,1,0,,,1101,Montgomery,32.2206831,-86.20969272,0,"Montgomery, Alabama, US"
04-01-2020,Alabama,US,2020-04-01 21:58:49,19,0,0,,,1103,Morgan,34.45500589,-86.85475946,0,"Morgan, Alabama, US"
04-01-2020,Alabama,US,2020-04-01 21:58:49,4,0,0,,,1107,Pickens,33.28094866,-88.08818103,0,"Pickens, Alabama, US"
04-01-2020,Alabama,US,2020-04-01 21:58:49,5,0,0,,,1109,Pike,31.80396383,-85.9408295,0,"Pike, Alabama, US"
04-01-2020,Alabama,US,2020-04-01 21:58:49,5,0,0,,,1111,Randolph,33.29526734,-85.45708831,0,"Randolph, Alabama, US"
04-01-2020,Alabama,US,2020-04-01 21:58:49,1,0,0,,,1113,Russell,32.28725256,-85.18415324,0,"Russell, Alabama, US"
04-01-2020,Alabama,US,2020-04-01 21:58:49,88,3,0,,,1117,Shelby,33.26879845,-86.66232561,0,"Shelby, Alabama, US"
04-01-2020,Alabama,US,2020-04-01 21:58:49,18,0,0,,,1115,St. Clair,33.71902176,-86.31029372,0,"St. Clair, Alabama, US"
04-01-2020,Alabama,US,2020-04-01 21:58:49,2,0,0,,,1119,Sumter,32.59117397,-88.19916205,0,"Sumter, Alabama, US"
04-01-2020,Alabama,US,2020-04-01 21:58:49,7,0,0,,,1121,Talladega,33.37823223,-86.16886178,0,"Talladega, Alabama, US"
04-01-2020,Alabama,US,2020-04-01 21:58:49,13,1,0,,,1123,Tallapoosa,32.86698258,-85.79833053,0,"Tallapoosa, Alabama, US"
04-01-2020,Alabama,US,2020-04-01 21:58:49,30,0,0,,,1125,Tuscaloosa,33.28726072,-87.52556818,0,"Tuscaloosa, Alabama, US"
04-01-2020,Alabama,US,2020-04-01 21:58:49,0,0,0,,,,Unassigned,0,0,0,"Unassigned, Alabama, US"
04-01-2020,Alabama,US,2020-04-01 21:58:49,32,0,0,,,1127,Walker,33.80270512,-87.30027177,0,"Walker, Alabama, US"
04-01-2020,Alabama,US,2020-04-01 21:58:49,3,1,0,,,1129,Washington,31.4092794,-88.20689944,0,"Washington, Alabama, US"
04-01-2020,Alabama,US,2020-04-01 21:58:49,3,0,0,,,1131,Wilcox,31.98773215,-87.30891118,0,"Wilcox, Alabama, US"
04-01-2020,Alabama,US,2020-04-01 21:58:49,2,0,0,,,1133,Winston,34.15030532,-87.37325922,0,"Winston, Alabama, US"
04-02-2020,Alabama,US,2020-04-02 23:25:27,10,0,0,,,1001,Autauga,32.53952745,-86.64408227,0,"Autauga, Alabama, US"
04-02-2020,Alabama,US,2020-04-02 23:25:27,24,1,0,,,1003,Baldwin,30.72774991,-87.72207058,0,"Baldwin, Alabama, US"
04-02-2020,Alabama,US,2020-04-02 23:25:27,4,0,0,,,1007,Bibb,32.99642064,-87.1251146,0,"Bibb, Alabama, US"
04-02-2020,Alabama,US,2020-04-02 23:25:27,6,0,0,,,1009,Blount,33.98210918,-86.56790593,0,"Blount, Alabama, US"
04-02-2020,Alabama,US,2020-04-02 23:25:27,2,0,0,,,1011,Bullock,32.10030533,-85.71265535,0,"Bullock, Alabama, US"
04-02-2020,Alabama,US,2020-04-02 23:25:27,1,0,0,,,1013,Butler,31.75300095,-86.68057478,0,"Butler, Alabama, US"
04-02-2020,Alabama,US,2020-04-02 23:25:27,12,0,0,,,1015,Calhoun,33.77483727,-85.82630386,0,"Calhoun, Alabama, US"
04-02-2020,Alabama,US,2020-04-02 23:25:27,67,4,0,,,1017,Chambers,32.91360079,-85.39072749,0,"Chambers, Alabama, US"
04-02-2020,Alabama,US,2020-04-02 23:25:27,4,0,0,,,1019,Cherokee,34.17805983,-85.60638968,0,"Cherokee, Alabama, US"
04-02-2020,Alabama,US,2020-04-02 23:25:27,14,0,0,,,1021,Chilton,32.85044126,-86.7173256,0,"Chilton, Alabama, US"
04-02-2020,Alabama,US,2020-04-02 23:25:27,4,0,0,,,1023,Choctaw,32.02227341,-88.2656443,0,"Choctaw, Alabama, US"
04-02-2020,Alabama,US,2020-04-02 23:25:27,2,0,0,,,1025,Clarke,31.68099859,-87.83548597,0,"Clarke, Alabama, US"
04-02-2020,Alabama,US,2020-04-02 23:25:27,6,0,0,,,1027,Clay,33.26984193,-85.85836077,0,"Clay, Alabama, US"
04-02-2020,Alabama,US,2020-04-02 23:25:27,6,0,0,,,1029,Cleburne,33.67679204,-85.52005899,0,"Cleburne, Alabama, US"
04-02-2020,Alabama,US,2020-04-02 23:25:27,1,0,0,,,1031,Coffee,31.39932826,-85.98901039,0,"Coffee, Alabama, US"
04-02-2020,Alabama,US,2020-04-02 23:25:27,5,0,0,,,1033,Colbert,34.69847452,-87.80168544,0,"Colbert, Alabama, US"
04-02-2020,Alabama,US,2020-04-02 23:25:27,1,0,0,,,1035,Conecuh,31.43401703,-86.99320044,0,"Conecuh, Alabama, US"
04-02-2020,Alabama,US,2020-04-02 23:25:27,5,0,0,,,1037,Coosa,32.93690146,-86.24847739,0,"Coosa, Alabama, US"
04-02-2020,Alabama,US,2020-04-02 23:25:27,3,0,0,,,1039,Covington,31.2477854,-86.45050893,0,"Covington, Alabama, US"
04-02-2020,Alabama,US,2020-04-02 23:25:27,1,0,0,,,1041,Crenshaw,31.72941803,-86.31593104,0,"Crenshaw, Alabama, US"
04-02-2020,Alabama,US,2020-04-02 23:25:27,9,1,0,,,1043,Cullman,34.13020303,-86.86888037,0,"Cullman, Alabama, US"
04-02-2020,Alabama,US,2020-04-02 23:25:27,1,0,0,,,1045,Dale,31.43037123,-85.61095742,0,"Dale, Alabama, US"
04-02-2020,Alabama,US,2020-04-02 23:25:27,4,0,0,,,1047,Dallas,32.32688101,-87.1086671,0,"Dallas, Alabama, US"
04-02-2020,Alabama,US,2020-04-02 23:25:27,8,0,0,,,1049,DeKalb,34.45946862,-85.80782906,0,"DeKalb, Alabama, US"
04-02-2020,Alabama,US,2020-04-02 23:25:27,17,0,0,,,1051,Elmore,32.59785413,-86.14415284,0,"Elmore, Alabama, US"
04-02-2020,Alabama,US,2020-04-02 23:25:27,2,0,0,,,1053,Escambia,31.1256789,-87.15918694,0,"Escambia, Alabama, US"
04-02-2020,Alabama,US,2020-04-02 23:25:27,13,1,0,,,1055,Etowah,34.04567266,-86.04051873,0,"Etowah, Alabama, US"
04-02-2020,Alabama,US,2020-04-02 23:25:27,1,0,0,,,1057,Fayette,33.72076938,-87.73886638,0,"Fayette, Alabama, US"
04-02-2020,Alabama,US,2020-04-02 23:25:27,4,0,0,,,1059,Franklin,34.44235334,-87.84289505,0,"Franklin, Alabama, US"
04-02-2020,Alabama,US,2020-04-02 23:25:27,4,0,0,,,1063,Greene,32.85504247,-87.95684022,0,"Greene, Alabama, US"
04-02-2020,Alabama,US,2020-04-02 23:25:27,1,0,0,,,1065,Hale,32.76039258,-87.63284988,0,"Hale, Alabama, US"
04-02-2020,Alabama,US,2020-04-02 23:25:27,9,0,0,,,1069,Houston,31.15197924,-85.29939599,0,"Houston, Alabama, US"
04-02-2020,Alabama,US,2020-04-02 23:25:27,9,1,0,,,1071,Jackson,34.78144169,-85.99750489,0,"Jackson, Alabama, US"
04-02-2020,Alabama,US,2020-04-02 23:25:27,314,4,0,,,1073,Jefferson,33.55554728,-86.895063,0,"Jefferson, Alabama, US"
04-02-2020,Alabama,US,2020-04-02 23:25:27,1,0,0,,,1075,Lamar,33.77995024,-88.09668032,0,"Lamar, Alabama, US"
04-02-2020,Alabama,US,2020-04-02 23:25:27,14,1,0,,,1077,Lauderdale,34.90171875,-87.65624729,0,"Lauderdale, Alabama, US"
04-02-2020,Alabama,US,2020-04-02 23:25:27,3,0,0,,,1079,Lawrence,34.52041498,-87.31069453,0,"Lawrence, Alabama, US"
04-02-2020,Alabama,US,2020-04-02 23:25:27,91,2,0,,,1081,Lee,32.60154883,-85.35132246,0,"Lee, Alabama, US"
04-02-2020,Alabama,US,2020-04-02 23:25:27,25,0,0,,,1083,Limestone,34.81185586,-86.98310072,0,"Limestone, Alabama, US"
04-02-2020,Alabama,US,2020-04-02 23:25:27,2,0,0,,,1085,Lowndes,32.1597283,-86.65158371,0,"Lowndes, Alabama, US"
04-02-2020,Alabama,US,2020-04-02 23:25:27,3,0,0,,,1087,Macon,32.38759944,-85.69267724,0,"Macon, Alabama, US"
04-02-2020,Alabama,US,2020-04-02 23:25:27,114,1,0,,,1089,Madison,34.76327133,-86.55069633,0,"Madison, Alabama, US"
04-02-2020,Alabama,US,2020-04-02 23:25:27,5,0,0,,,1091,Marengo,32.24767634,-87.78796182,0,"Marengo, Alabama, US"
04-02-2020,Alabama,US,2020-04-02 23:25:27,11,2,0,,,1093,Marion,34.13697363,-87.88704173,0,"Marion, Alabama, US"
04-02-2020,Alabama,US,2020-04-02 23:25:27,6,0,0,,,1095,Marshall,34.36975964,-86.30486727,0,"Marshall, Alabama, US"
04-02-2020,Alabama,US,2020-04-02 23:25:27,67,3,0,,,1097,Mobile,30.78472347,-88.20842409,0,"Mobile, Alabama, US"
04-02-2020,Alabama,US,2020-04-02 23:25:27,3,0,0,,,1099,Monroe,31.56729412,-87.36995001,0,"Monroe, Alabama, US"
04-02-2020,Alabama,US,2020-04-02 23:25:27,45,1,0,,,1101,Montgomery,32.2206831,-86.20969272,0,"Montgomery, Alabama, US"
04-02-2020,Alabama,US,2020-04-02 23:25:27,21,0,0,,,1103,Morgan,34.45500589,-86.85475946,0,"Morgan, Alabama, US"
04-02-2020,Alabama,US,2020-04-02 23:25:27,9,0,0,,,1107,Pickens,33.28094866,-88.08818103,0,"Pickens, Alabama, US"
04-02-2020,Alabama,US,2020-04-02 23:25:27,7,0,0,,,1109,Pike,31.80396383,-85.9408295,0,"Pike, Alabama, US"
04-02-2020,Alabama,US,2020-04-02 23:25:27,6,0,0,,,1111,Randolph,33.29526734,-85.45708831,0,"Randolph, Alabama, US"
04-02-2020,Alabama,US,2020-04-02 23:25:27,2,0,0,,,1113,Russell,32.28725256,-85.18415324,0,"Russell, Alabama, US"
04-02-2020,Alabama,US,2020-04-02 23:25:27,98,3,0,,,1117,Shelby,33.26879845,-86.66232561,0,"Shelby, Alabama, US"
04-02-2020,Alabama,US,2020-04-02 23:25:27,19,0,0,,,1115,St. Clair,33.71902176,-86.31029372,0,"St. Clair, Alabama, US"
04-02-2020,Alabama,US,2020-04-02 23:25:27,4,0,0,,,1119,Sumter,32.59117397,-88.19916205,0,"Sumter, Alabama, US"
04-02-2020,Alabama,US,2020-04-02 23:25:27,8,0,0,,,1121,Talladega,33.37823223,-86.16886178,0,"Talladega, Alabama, US"
04-02-2020,Alabama,US,2020-04-02 23:25:27,17,1,0,,,1123,Tallapoosa,32.86698258,-85.79833053,0,"Tallapoosa, Alabama, US"
04-02-2020,Alabama,US,2020-04-02 23:25:27,34,0,0,,,1125,Tuscaloosa,33.28726072,-87.52556818,0,"Tuscaloosa, Alabama, US"
04-02-2020,Alabama,US,2020-04-02 23:25:27,0,5,0,,,90001,Unassigned,,,0,"Unassigned, Alabama, US"
04-02-2020,Alabama,US,2020-04-02 23:25:27,34,0,0,,,1127,Walker,33.80270512,-87.30027177,0,"Walker, Alabama, US"
04-02-2020,Alabama,US,2020-04-02 23:25:27,3,1,0,,,1129,Washington,31.4092794,-88.20689944,0,"Washington, Alabama, US"
04-02-2020,Alabama,US,2020-04-02 23:25:27,5,0,0,,,1131,Wilcox,31.98773215,-87.30891118,0,"Wilcox, Alabama, US"
04-02-2020,Alabama,US,2020-04-02 23:25:27,2,0,0,,,1133,Winston,34.15030532,-87.37325922,0,"Winston, Alabama, US"
03-22-2020,Alabama,US,3/22/20 23:45,71,0,0,,,1073,Jefferson,33.55554728,-86.895063,0,"Jefferson, Alabama, US"
03-22-2020,Alabama,US,3/22/20 23:45,17,0,0,,,1117,Shelby,33.26879845,-86.66232561,0,"Shelby, Alabama, US"
03-22-2020,Alabama,US,3/22/20 23:45,16,0,0,,,1081,Lee,32.60154883,-85.35132246,0,"Lee, Alabama, US"
03-22-2020,Alabama,US,3/22/20 23:45,16,0,0,,,1089,Madison,34.76327133,-86.55069633,0,"Madison, Alabama, US"
03-22-2020,Alabama,US,3/22/20 23:45,7,0,0,,,1125,Tuscaloosa,33.28726072,-87.52556818,0,"Tuscaloosa, Alabama, US"
03-22-2020,Alabama,US,3/22/20 23:45,6,0,0,,,1051,Elmore,32.59785413,-86.14415284,0,"Elmore, Alabama, US"
03-22-2020,Alabama,US,3/22/20 23:45,3,0,0,,,1101,Montgomery,32.2206831,-86.20969272,0,"Montgomery, Alabama, US"
03-22-2020,Alabama,US,3/22/20 23:45,3,0,0,,,1115,St. Clair,33.71902176,-86.31029372,0,"St. Clair, Alabama, US"
03-22-2020,Alabama,US,3/22/20 23:45,2,0,0,,,1003,Baldwin,30.72774991,-87.72207058,0,"Baldwin, Alabama, US"
03-22-2020,Alabama,US,3/22/20 23:45,2,0,0,,,1017,Chambers,32.91360079,-85.39072749,0,"Chambers, Alabama, US"
03-22-2020,Alabama,US,3/22/20 23:45,2,0,0,,,1097,Mobile,30.78472347,-88.20842409,0,"Mobile, Alabama, US"
03-22-2020,Alabama,US,3/22/20 23:45,2,0,0,,,1077,Lauderdale,34.90171875,-87.65624729,0,"Lauderdale, Alabama, US"
03-22-2020,Alabama,US,3/22/20 23:45,2,0,0,,,1043,Cullman,34.13020303,-86.86888037,0,"Cullman, Alabama, US"
03-22-2020,Alabama,US,3/22/20 23:45,1,0,0,,,1083,Limestone,34.81185586,-86.98310072,0,"Limestone, Alabama, US"
03-22-2020,Alabama,US,3/22/20 23:45,1,0,0,,,1015,Calhoun,33.77483727,-85.82630386,0,"Calhoun, Alabama, US"
03-22-2020,Alabama,US,3/22/20 23:45,1,0,0,,,1121,Talladega,33.37823223,-86.16886178,0,"Talladega, Alabama, US"
03-22-2020,Alabama,US,3/22/20 23:45,1,0,0,,,1127,Walker,33.80270512,-87.30027177,0,"Walker, Alabama, US"
03-22-2020,Alabama,US,3/22/20 23:45,1,0,0,,,1071,Jackson,34.78144169,-85.99750489,0,"Jackson, Alabama, US"
03-22-2020,Alabama,US,3/22/20 23:45,1,0,0,,,1075,Lamar,33.77995024,-88.09668032,0,"Lamar, Alabama, US"
03-22-2020,Alabama,US,3/22/20 23:45,1,0,0,,,1129,Washington,31.4092794,-88.20689944,0,"Washington, Alabama, US"
03-22-2020,Alabama,US,3/22/20 23:45,1,0,0,,,1093,Marion,34.13697363,-87.88704173,0,"Marion, Alabama, US"
03-22-2020,Alabama,US,3/22/20 23:45,0,0,0,,,1001,Autauga,32.53952745,-86.64408227,0,"Autauga, Alabama, US"
03-22-2020,Alabama,US,3/22/20 23:45,0,0,0,,,1005,Barbour,31.868263,-85.3871286,0,"Barbour, Alabama, US"
03-22-2020,Alabama,US,3/22/20 23:45,0,0,0,,,1007,Bibb,32.99642064,-87.1251146,0,"Bibb, Alabama, US"
03-22-2020,Alabama,US,3/22/20 23:45,0,0,0,,,1009,Blount,33.98210918,-86.56790593,0,"Blount, Alabama, US"
03-22-2020,Alabama,US,3/22/20 23:45,0,0,0,,,1011,Bullock,32.10030533,-85.71265535,0,"Bullock, Alabama, US"
03-22-2020,Alabama,US,3/22/20 23:45,0,0,0,,,1013,Butler,31.75300095,-86.68057478,0,"Butler, Alabama, US"
03-22-2020,Alabama,US,3/22/20 23:45,0,0,0,,,1019,Cherokee,34.17805983,-85.60638968,0,"Cherokee, Alabama, US"
03-22-2020,Alabama,US,3/22/20 23:45,0,0,0,,,1021,Chilton,32.85044126,-86.7173256,0,"Chilton, Alabama, US"
03-22-2020,Alabama,US,3/22/20 23:45,0,0,0,,,1023,Choctaw,32.02227341,-88.2656443,0,"Choctaw, Alabama, US"
03-22-2020,Alabama,US,3/22/20 23:45,0,0,0,,,1025,Clarke,31.68099859,-87.83548597,0,"Clarke, Alabama, US"
03-22-2020,Alabama,US,3/22/20 23:45,0,0,0,,,1027,Clay,33.26984193,-85.85836077,0,"Clay, Alabama, US"
03-22-2020,Alabama,US,3/22/20 23:45,0,0,0,,,1029,Cleburne,33.67679204,-85.52005899,0,"Cleburne, Alabama, US"
03-22-2020,Alabama,US,3/22/20 23:45,0,0,0,,,1031,Coffee,31.39932826,-85.98901039,0,"Coffee, Alabama, US"
03-22-2020,Alabama,US,3/22/20 23:45,0,0,0,,,1033,Colbert,34.69847452,-87.80168544,0,"Colbert, Alabama, US"
03-22-2020,Alabama,US,3/22/20 23:45,0,0,0,,,1035,Conecuh,31.43401703,-86.99320044,0,"Conecuh, Alabama, US"
03-22-2020,Alabama,US,3/22/20 23:45,0,0,0,,,1037,Coosa,32.93690146,-86.24847739,0,"Coosa, Alabama, US"
03-22-2020,Alabama,US,3/22/20 23:45,0,0,0,,,1039,Covington,31.2477854,-86.45050893,0,"Covington, Alabama, US"
03-22-2020,Alabama,US,3/22/20 23:45,0,0,0,,,1041,Crenshaw,31.72941803,-86.31593104,0,"Crenshaw, Alabama, US"
03-22-2020,Alabama,US,3/22/20 23:45,0,0,0,,,1045,Dale,31.43037123,-85.61095742,0,"Dale, Alabama, US"
03-22-2020,Alabama,US,3/22/20 23:45,0,0,0,,,1047,Dallas,32.32688101,-87.1086671,0,"Dallas, Alabama, US"
03-22-2020,Alabama,US,3/22/20 23:45,0,0,0,,,1049,DeKalb,34.45946862,-85.80782906,0,"DeKalb, Alabama, US"
03-22-2020,Alabama,US,3/22/20 23:45,0,0,0,,,1053,Escambia,31.1256789,-87.15918694,0,"Escambia, Alabama, US"
03-22-2020,Alabama,US,3/22/20 23:45,0,0,0,,,1055,Etowah,34.04567266,-86.04051873,0,"Etowah, Alabama, US"
03-22-2020,Alabama,US,3/22/20 23:45,0,0,0,,,1057,Fayette,33.72076938,-87.73886638,0,"Fayette, Alabama, US"
03-22-2020,Alabama,US,3/22/20 23:45,0,0,0,,,1059,Franklin,34.44235334,-87.84289505,0,"Franklin, Alabama, US"
03-22-2020,Alabama,US,3/22/20 23:45,0,0,0,,,1061,Geneva,31.09389027,-85.83572839,0,"Geneva, Alabama, US"
03-22-2020,Alabama,US,3/22/20 23:45,0,0,0,,,1063,Greene,32.85504247,-87.95684022,0,"Greene, Alabama, US"
03-22-2020,Alabama,US,3/22/20 23:45,0,0,0,,,1065,Hale,32.76039258,-87.63284988,0,"Hale, Alabama, US"
03-22-2020,Alabama,US,3/22/20 23:45,0,0,0,,,1067,Henry,31.51148016,-85.24267944,0,"Henry, Alabama, US"
03-22-2020,Alabama,US,3/22/20 23:45,0,0,0,,,1069,Houston,31.15197924,-85.29939599,0,"Houston, Alabama, US"
03-22-2020,Alabama,US,3/22/20 23:45,0,0,0,,,1079,Lawrence,34.52041498,-87.31069453,0,"Lawrence, Alabama, US"
03-22-2020,Alabama,US,3/22/20 23:45,0,0,0,,,1085,Lowndes,32.1597283,-86.65158371,0,"Lowndes, Alabama, US"
03-22-2020,Alabama,US,3/22/20 23:45,0,0,0,,,1087,Macon,32.38759944,-85.69267724,0,"Macon, Alabama, US"
03-22-2020,Alabama,US,3/22/20 23:45,0,0,0,,,1091,Marengo,32.24767634,-87.78796182,0,"Marengo, Alabama, US"
03-22-2020,Alabama,US,3/22/20 23:45,0,0,0,,,1095,Marshall,34.36975964,-86.30486727,0,"Marshall, Alabama, US"
03-22-2020,Alabama,US,3/22/20 23:45,0,0,0,,,1099,Monroe,31.56729412,-87.36995001,0,"Monroe, Alabama, US"
03-22-2020,Alabama,US,3/22/20 23:45,0,0,0,,,1103,Morgan,34.45500589,-86.85475946,0,"Morgan, Alabama, US"
03-22-2020,Alabama,US,3/22/20 23:45,0,0,0,,,1105,Perry,32.64048341,-87.29770589,0,"Perry, Alabama, US"
03-22-2020,Alabama,US,3/22/20 23:45,0,0,0,,,1107,Pickens,33.28094866,-88.08818103,0,"Pickens, Alabama, US"
03-22-2020,Alabama,US,3/22/20 23:45,0,0,0,,,1109,Pike,31.80396383,-85.9408295,0,"Pike, Alabama, US"
03-22-2020,Alabama,US,3/22/20 23:45,0,0,0,,,1111,Randolph,33.29526734,-85.45708831,0,"Randolph, Alabama, US"
03-22-2020,Alabama,US,3/22/20 23:45,0,0,0,,,1113,Russell,32.28725256,-85.18415324,0,"Russell, Alabama, US"
03-22-2020,Alabama,US,3/22/20 23:45,0,0,0,,,1119,Sumter,32.59117397,-88.19916205,0,"Sumter, Alabama, US"
03-22-2020,Alabama,US,3/22/20 23:45,0,0,0,,,1123,Tallapoosa,32.86698258,-85.79833053,0,"Tallapoosa, Alabama, US"
03-22-2020,Alabama,US,3/22/20 23:45,0,0,0,,,1131,Wilcox,31.98773215,-87.30891118,0,"Wilcox, Alabama, US"
03-22-2020,Alabama,US,3/22/20 23:45,0,0,0,,,1133,Winston,34.15030532,-87.37325922,0,"Winston, Alabama, US"
03-10-2020,Alaska,US,2020-03-10T02:33:04,0,0,0,61.3707,-152.4044,,,,,,
03-11-2020,Alaska,US,2020-03-10T02:33:04,0,0,0,61.3707,-152.4044,,,,,,
03-12-2020,Alaska,US,2020-03-10T02:33:04,0,0,0,61.3707,-152.4044,,,,,,
03-13-2020,Alaska,US,2020-03-11T20:00:00,1,0,0,61.370716,-152.404419,,,,,,
03-15-2020,Alaska,US,2020-03-13T14:53:03,1,0,0,61.3707,-152.4044,,,,,,
03-16-2020,Alaska,US,2020-03-13T14:53:03,1,0,0,61.3707,-152.4044,,,,,,
03-17-2020,Alaska,US,2020-03-17T17:33:03,3,0,0,61.3707,-152.4044,,,,,,
03-18-2020,Alaska,US,2020-03-18T05:53:25,6,0,0,61.3707,-152.4044,,,,,,
03-19-2020,Alaska,US,2020-03-19T02:33:09,9,0,0,61.3707,-152.4044,,,,,,
03-20-2020,Alaska,US,2020-03-20T16:43:10,12,0,0,61.3707,-152.4044,,,,,,
03-21-2020,Alaska,US,2020-03-21T23:13:18,15,0,0,61.3707,-152.4044,,,,,,
03-23-2020,Alaska,US,2020-03-23 23:19:34,0,0,0,,,2013,Aleutians East,55.32222414,-161.9722021,0,"Aleutians East, Alaska, US"
03-23-2020,Alaska,US,2020-03-23 23:19:34,0,0,0,,,2016,Aleutians West,52.72541116,-110.4086433,0,"Aleutians West, Alaska, US"
03-23-2020,Alaska,US,2020-03-23 23:19:34,13,0,0,,,2020,Anchorage,61.14998174,-149.1426986,0,"Anchorage, Alaska, US"
03-23-2020,Alaska,US,2020-03-23 23:19:34,0,0,0,,,2050,Bethel,60.90980451,-159.8561831,0,"Bethel, Alaska, US"
03-23-2020,Alaska,US,2020-03-23 23:19:34,0,0,0,,,2060,Bristol Bay,58.74513976,-156.701064,0,"Bristol Bay, Alaska, US"
03-23-2020,Alaska,US,2020-03-23 23:19:34,0,0,0,,,2068,Denali,63.67264044,-150.0076108,0,"Denali, Alaska, US"
03-23-2020,Alaska,US,2020-03-23 23:19:34,0,0,0,,,2070,Dillingham,59.79603738,-158.2381942,0,"Dillingham, Alaska, US"
03-23-2020,Alaska,US,2020-03-23 23:19:34,7,0,0,,,2090,Fairbanks North Star,64.80726247,-146.5692662,0,"Fairbanks North Star, Alaska, US"
03-23-2020,Alaska,US,2020-03-23 23:19:34,0,0,0,,,2100,Haines,59.09893571,-135.4679843,0,"Haines, Alaska, US"
03-23-2020,Alaska,US,2020-03-23 23:19:34,0,0,0,,,2105,Hoonah-Angoon,58.29307365,-135.6424424,0,"Hoonah-Angoon, Alaska, US"
03-23-2020,Alaska,US,2020-03-23 23:19:34,1,0,0,,,2110,Juneau,58.45031811,-134.200436,0,"Juneau, Alaska, US"
03-23-2020,Alaska,US,2020-03-23 23:19:34,3,0,0,,,2122,Kenai Peninsula,60.24429722,-151.5388884,0,"Kenai Peninsula,Alaska,US"
03-23-2020,Alaska,US,2020-03-23 23:19:34,6,0,0,,,2130,Ketchikan Gateway,55.57445008,-130.975561,0,"Ketchikan Gateway, Alaska, US"
03-23-2020,Alaska,US,2020-03-23 23:19:34,0,0,0,,,2150,Kodiak Island,57.65529415,-153.7493579,0,"Kodiak Island, Alaska, US"
03-23-2020,Alaska,US,2020-03-23 23:19:34,0,0,0,,,2158,Kusilvak,62.1542916,-163.3967883,0,"Kusilvak, Alaska, US"
03-23-2020,Alaska,US,2020-03-23 23:19:34,0,0,0,,,2164,Lake and Peninsula,58.62403337,-156.2140589,0,"Lake and Peninsula, Alaska, US"
03-23-2020,Alaska,US,2020-03-23 23:19:34,0,0,0,,,2170,Matanuska-Susitna,62.31305045,-149.5741743,0,"Matanuska-Susitna, Alaska, US"
03-23-2020,Alaska,US,2020-03-23 23:19:34,0,0,0,,,2180,Nome,64.90320724,-164.0353804,0,"Nome, Alaska, US"
03-23-2020,Alaska,US,2020-03-23 23:19:34,0,0,0,,,2185,North Slope,69.31479216,-153.4836093,0,"North Slope, Alaska, US"
03-23-2020,Alaska,US,2020-03-23 23:19:34,0,0,0,,,2188,Northwest Arctic,67.04919196,-159.7503946,0,"Northwest Arctic, Alaska, US"
03-23-2020,Alaska,US,2020-03-23 23:19:34,0,0,0,,,2195,Petersburg,57.13978948,-132.9540995,0,"Petersburg, Alaska, US"
03-23-2020,Alaska,US,2020-03-23 23:19:34,0,0,0,,,2198,Prince of Wales-Hyder,55.76261984,-133.0511621,0,"Prince of Wales-Hyder, Alaska, US"
03-23-2020,Alaska,US,2020-03-23 23:19:34,0,0,0,,,2220,Sitka,57.24124555,-135.3206587,0,"Sitka, Alaska, US"
03-23-2020,Alaska,US,2020-03-23 23:19:34,0,0,0,,,2230,Skagway,59.56149996,-135.3337748,0,"Skagway, Alaska, US"
03-23-2020,Alaska,US,2020-03-23 23:19:34,0,0,0,,,2240,Southeast Fairbanks,63.87692095,-143.2127643,0,"Southeast Fairbanks, Alaska, US"
03-23-2020,Alaska,US,2020-03-23 23:19:34,0,0,0,,,2261,Valdez-Cordova,61.47502768,-144.7126799,0,"Valdez-Cordova, Alaska, US"
03-23-2020,Alaska,US,2020-03-23 23:19:34,0,0,0,,,2275,Wrangell,56.3202004,-132.0583731,0,"Wrangell, Alaska, US"
03-23-2020,Alaska,US,2020-03-23 23:19:34,0,0,0,,,2282,Yakutat,59.8909808,-140.3601451,0,"Yakutat, Alaska, US"
03-23-2020,Alaska,US,2020-03-23 23:19:34,0,0,0,,,2290,Yukon-Koyukuk,65.50815459,-151.3907387,0,"Yukon-Koyukuk, Alaska, US"
03-24-2020,Alaska,US,2020-03-24 23:37:31,0,0,0,,,2013,Aleutians East,55.32222414,-161.9722021,0,"Aleutians East, Alaska, US"
03-24-2020,Alaska,US,2020-03-24 23:37:31,0,0,0,,,2016,Aleutians West,52.72541116,-110.4086433,0,"Aleutians West, Alaska, US"
03-24-2020,Alaska,US,2020-03-24 23:37:31,17,0,0,,,2020,Anchorage,61.14998174,-149.1426986,0,"Anchorage, Alaska, US"
03-24-2020,Alaska,US,2020-03-24 23:37:31,0,0,0,,,2050,Bethel,60.90980451,-159.8561831,0,"Bethel, Alaska, US"
03-24-2020,Alaska,US,2020-03-24 23:37:31,0,0,0,,,2060,Bristol Bay,58.74513976,-156.701064,0,"Bristol Bay, Alaska, US"
03-24-2020,Alaska,US,2020-03-24 23:37:31,0,0,0,,,2068,Denali,63.67264044,-150.0076108,0,"Denali, Alaska, US"
03-24-2020,Alaska,US,2020-03-24 23:37:31,0,0,0,,,2070,Dillingham,59.79603738,-158.2381942,0,"Dillingham, Alaska, US"
03-24-2020,Alaska,US,2020-03-24 23:37:31,7,0,0,,,2090,Fairbanks North Star,64.80726247,-146.5692662,0,"Fairbanks North Star, Alaska, US"
03-24-2020,Alaska,US,2020-03-24 23:37:31,0,0,0,,,2100,Haines,59.09893571,-135.4679843,0,"Haines, Alaska, US"
03-24-2020,Alaska,US,2020-03-24 23:37:31,0,0,0,,,2105,Hoonah-Angoon,58.29307365,-135.6424424,0,"Hoonah-Angoon, Alaska, US"
03-24-2020,Alaska,US,2020-03-24 23:37:31,1,0,0,,,2110,Juneau,58.45031811,-134.200436,0,"Juneau, Alaska, US"
03-24-2020,Alaska,US,2020-03-24 23:37:31,3,0,0,,,2122,Kenai Peninsula,60.24429722,-151.5388884,0,"Kenai Peninsula,Alaska,US"
03-24-2020,Alaska,US,2020-03-24 23:37:31,6,0,0,,,2130,Ketchikan Gateway,55.57445008,-130.975561,0,"Ketchikan Gateway, Alaska, US"
03-24-2020,Alaska,US,2020-03-24 23:37:31,0,0,0,,,2150,Kodiak Island,57.65529415,-153.7493579,0,"Kodiak Island, Alaska, US"
03-24-2020,Alaska,US,2020-03-24 23:37:31,0,0,0,,,2158,Kusilvak,62.1542916,-163.3967883,0,"Kusilvak, Alaska, US"
03-24-2020,Alaska,US,2020-03-24 23:37:31,0,0,0,,,2164,Lake and Peninsula,58.62403337,-156.2140589,0,"Lake and Peninsula, Alaska, US"
03-24-2020,Alaska,US,2020-03-24 23:37:31,0,0,0,,,2170,Matanuska-Susitna,62.31305045,-149.5741743,0,"Matanuska-Susitna, Alaska, US"
03-24-2020,Alaska,US,2020-03-24 23:37:31,0,0,0,,,2180,Nome,64.90320724,-164.0353804,0,"Nome, Alaska, US"
03-24-2020,Alaska,US,2020-03-24 23:37:31,0,0,0,,,2185,North Slope,69.31479216,-153.4836093,0,"North Slope, Alaska, US"
03-24-2020,Alaska,US,2020-03-24 23:37:31,0,0,0,,,2188,Northwest Arctic,67.04919196,-159.7503946,0,"Northwest Arctic, Alaska, US"
03-24-2020,Alaska,US,2020-03-24 23:37:31,0,0,0,,,2195,Petersburg,57.13978948,-132.9540995,0,"Petersburg, Alaska, US"
03-24-2020,Alaska,US,2020-03-24 23:37:31,0,0,0,,,2198,Prince of Wales-Hyder,55.76261984,-133.0511621,0,"Prince of Wales-Hyder, Alaska, US"
03-24-2020,Alaska,US,2020-03-24 23:37:31,0,0,0,,,2220,Sitka,57.24124555,-135.3206587,0,"Sitka, Alaska, US"
03-24-2020,Alaska,US,2020-03-24 23:37:31,0,0,0,,,2230,Skagway,59.56149996,-135.3337748,0,"Skagway, Alaska, US"
03-24-2020,Alaska,US,2020-03-24 23:37:31,0,0,0,,,2240,Southeast Fairbanks,63.87692095,-143.2127643,0,"Southeast Fairbanks, Alaska, US"
03-24-2020,Alaska,US,2020-03-24 23:37:31,0,0,0,,,2261,Valdez-Cordova,61.47502768,-144.7126799,0,"Valdez-Cordova, Alaska, US"
03-24-2020,Alaska,US,2020-03-24 23:37:31,0,0,0,,,2275,Wrangell,56.3202004,-132.0583731,0,"Wrangell, Alaska, US"
03-24-2020,Alaska,US,2020-03-24 23:37:31,0,0,0,,,2282,Yakutat,59.8909808,-140.3601451,0,"Yakutat, Alaska, US"
03-24-2020,Alaska,US,2020-03-24 23:37:31,0,0,0,,,2290,Yukon-Koyukuk,65.50815459,-151.3907387,0,"Yukon-Koyukuk, Alaska, US"
03-25-2020,Alaska,US,2020-03-25 23:33:19,0,0,0,,,2013,Aleutians East,55.32222414,-161.9722021,0,"Aleutians East, Alaska, US"
03-25-2020,Alaska,US,2020-03-25 23:33:19,0,0,0,,,2016,Aleutians West,52.72541116,-110.4086433,0,"Aleutians West, Alaska, US"
03-25-2020,Alaska,US,2020-03-25 23:33:19,17,0,0,,,2020,Anchorage,61.14998174,-149.1426986,0,"Anchorage, Alaska, US"
03-25-2020,Alaska,US,2020-03-25 23:33:19,0,0,0,,,2050,Bethel,60.90980451,-159.8561831,0,"Bethel, Alaska, US"
03-25-2020,Alaska,US,2020-03-25 23:33:19,0,0,0,,,2060,Bristol Bay,58.74513976,-156.701064,0,"Bristol Bay, Alaska, US"
03-25-2020,Alaska,US,2020-03-25 23:33:19,0,0,0,,,2068,Denali,63.67264044,-150.0076108,0,"Denali, Alaska, US"
03-25-2020,Alaska,US,2020-03-25 23:33:19,0,0,0,,,2070,Dillingham,59.79603738,-158.2381942,0,"Dillingham, Alaska, US"
03-25-2020,Alaska,US,2020-03-25 23:33:19,10,0,0,,,2090,Fairbanks North Star,64.80726247,-146.5692662,0,"Fairbanks North Star, Alaska, US"
03-25-2020,Alaska,US,2020-03-25 23:33:19,0,0,0,,,2100,Haines,59.09893571,-135.4679843,0,"Haines, Alaska, US"
03-25-2020,Alaska,US,2020-03-25 23:33:19,0,0,0,,,2105,Hoonah-Angoon,58.29307365,-135.6424424,0,"Hoonah-Angoon, Alaska, US"
03-25-2020,Alaska,US,2020-03-25 23:33:19,2,0,0,,,2110,Juneau,58.45031811,-134.200436,0,"Juneau, Alaska, US"
03-25-2020,Alaska,US,2020-03-25 23:33:19,4,0,0,,,2122,Kenai Peninsula,60.24429722,-151.5388884,0,"Kenai Peninsula,Alaska,US"
03-25-2020,Alaska,US,2020-03-25 23:33:19,8,0,0,,,2130,Ketchikan Gateway,55.57445008,-130.975561,0,"Ketchikan Gateway, Alaska, US"
03-25-2020,Alaska,US,2020-03-25 23:33:19,0,0,0,,,2150,Kodiak Island,57.65529415,-153.7493579,0,"Kodiak Island, Alaska, US"
03-25-2020,Alaska,US,2020-03-25 23:33:19,0,0,0,,,2158,Kusilvak,62.1542916,-163.3967883,0,"Kusilvak, Alaska, US"
03-25-2020,Alaska,US,2020-03-25 23:33:19,0,0,0,,,2164,Lake and Peninsula,58.62403337,-156.2140589,0,"Lake and Peninsula, Alaska, US"
03-25-2020,Alaska,US,2020-03-25 23:33:19,0,0,0,,,2170,Matanuska-Susitna,62.31305045,-149.5741743,0,"Matanuska-Susitna, Alaska, US"
03-25-2020,Alaska,US,2020-03-25 23:33:19,0,0,0,,,2180,Nome,64.90320724,-164.0353804,0,"Nome, Alaska, US"
03-25-2020,Alaska,US,2020-03-25 23:33:19,0,0,0,,,2185,North Slope,69.31479216,-153.4836093,0,"North Slope, Alaska, US"
03-25-2020,Alaska,US,2020-03-25 23:33:19,0,0,0,,,2188,Northwest Arctic,67.04919196,-159.7503946,0,"Northwest Arctic, Alaska, US"
03-25-2020,Alaska,US,2020-03-25 23:33:19,0,0,0,,,2195,Petersburg,57.13978948,-132.9540995,0,"Petersburg, Alaska, US"
03-25-2020,Alaska,US,2020-03-25 23:33:19,0,0,0,,,2198,Prince of Wales-Hyder,55.76261984,-133.0511621,0,"Prince of Wales-Hyder, Alaska, US"
03-25-2020,Alaska,US,2020-03-25 23:33:19,0,0,0,,,2220,Sitka,57.24124555,-135.3206587,0,"Sitka, Alaska, US"
03-25-2020,Alaska,US,2020-03-25 23:33:19,0,0,0,,,2230,Skagway,59.56149996,-135.3337748,0,"Skagway, Alaska, US"
03-25-2020,Alaska,US,2020-03-25 23:33:19,0,0,0,,,2240,Southeast Fairbanks,63.87692095,-143.2127643,0,"Southeast Fairbanks, Alaska, US"
03-25-2020,Alaska,US,2020-03-25 23:33:19,0,1,0,,,,Unassigned,0,0,0,"Unassigned, Alaska, US"
03-25-2020,Alaska,US,2020-03-25 23:33:19,0,0,0,,,2261,Valdez-Cordova,61.47502768,-144.7126799,0,"Valdez-Cordova, Alaska, US"
